Username,Date,Star Rating,Title,Review Comment,Review Link,User Profile Link
"SAJ",27-Dec-2016,5,"What's not to like?","To quote another modern technocrat, &#34;it just works.&#34; Setup: next to none; adding nodes: practically automatic; updates & maintenance: so far, self-healing. I wanted a 100% reliable system for a materials-dense house that I could plug in and forget, and that is what I got.","https://www.amazon.com/gp/customer-reviews/R3R7NZUP51B2IJ/ref=cm_cr_arp_d_rvw_ttl?ie=UTF8&ASIN=B00XEW3YD6","https://www.amazon.com/gp/pdp/profile/A2B5U64P9RFOKW/ref=cm_cr_arp_d_pdp?ie=UTF8"
"Ethan W.",27-Dec-2016,5,"but very easy to set up and works flawlessly","Somewhat pricey, but very easy to set up and works flawlessly.  I have three eeros in my home replacing three access points.  Wi-fi is faster and much more reliable.  The system behaves exactly as advertised.Pros: ease of setup and use, flawless performance, rock solid reliabilityCons: price (but worth it, in my opinion)","https://www.amazon.com/gp/customer-reviews/R3LWLMKYXJXP6Z/ref=cm_cr_arp_d_rvw_ttl?ie=UTF8&ASIN=B00XEW3YD6","https://www.amazon.com/gp/pdp/profile/A18WUUAI9K2Z1F/ref=cm_cr_arp_d_pdp?ie=UTF8"
"Amazon Customer",27-Dec-2016,1,"Disk Malfunction","I was excited to receive the Eero system, which worked well until one of the disks malfunctioned, causing significant disruption in service at great cost. We will see how they respond and rectify the situation! David","https://www.amazon.com/gp/customer-reviews/R33AG2SDEMDA66/ref=cm_cr_arp_d_rvw_ttl?ie=UTF8&ASIN=B00XEW3YD6","https://www.amazon.com/gp/pdp/profile/A3JTDB5PU0ALE2/ref=cm_cr_arp_d_pdp?ie=UTF8"
"mattman122",27-Dec-2016,5,"Awesome!!!","The only thing that needs to be said about this product: awesome.  Set-up was awesome...took 15 minutes and worked flawlessly.  Performance has been awesome...no dead zones, excellent speeds.  App is awesome...so simple yet provides all the information you could want or need.This is a well thought out solution.  Simple yet powerful.  Would recommend this product to everyone.","https://www.amazon.com/gp/customer-reviews/R2W7C7BZO8ZHM3/ref=cm_cr_arp_d_rvw_ttl?ie=UTF8&ASIN=B00XEW3YD6","https://www.amazon.com/gp/pdp/profile/AGC3E3JKLHH6M/ref=cm_cr_arp_d_pdp?ie=UTF8"
"Jensen",27-Dec-2016,5,"Eero is a lifesaver!","I absolutely love EERO!!  We have a 3 story home that I thought I could blanket with just using a router and then an extender.  Immediately the extender broke and we lost wifi all the time.  So then I came across Eero, figured it was worth a try.  I couldn't be happier!  I have 3 eeros (1 on each floor) they blanket the whole house, I haven't lost wifi unless it was something with my provider!  If you want amazing wifi and great connection go buy this right now!","https://www.amazon.com/gp/customer-reviews/R26VW68NAUR2KM/ref=cm_cr_arp_d_rvw_ttl?ie=UTF8&ASIN=B00XEW3YD6","https://www.amazon.com/gp/pdp/profile/A1USURUA6BFKS/ref=cm_cr_arp_d_pdp?ie=UTF8"
"WolfX5",26-Dec-2016,5,"Great product but be aware of some SERIOUS PRIVACY ISSUES WITH USING EERO...","First let me say that this product works well and have solved a very difficult wifi coverage issue for my business.  I am getting my full 50MB download speed at the Eero connected to my router and about 30 - 40MB on average around the office, sometimes in places where I got literally ZERO connection before Eero, so I'm pleased with it's performance. What I'm NOT pleased about is the invasion of privacy that Eero products seem to come bundled with. In essence, because you MUST use the Eero app to set up the network, and that software ONLY comes as an Android phone or Iphone app (IOS on Ipad is NOT supported!), you are basically FORCED to give Eero a working cellular phone number linked to your account. Also, because Google enforces cell phone authentication now when you download Android apps, if you use Eero's Android app and you've never given Google your actual cell phone number you will have to do that too just to get the Eero app loaded on your phone. Ridiculous. No doubt both Eero and Google could use your cellular number to tie every bit of your web traffic to the owner of the cellular phone if they so choose which doesn't bode well for privacy advocates. There also doesn't appear to be a way for Eero to enforce MAC authentication so if you're used to using specific MAC addresses to limit what devices can connect to your router you are out of luck. Anyone who can sniff your wifi traffic and decrypt it will have full access to your network. I frankly think it is entirely disrespectful of a company to force you into this situation and if it wasn't for the absolute necessity of having Wifi coverage using Eero I would have chosen another vendor because of these privacy concerns.","https://www.amazon.com/gp/customer-reviews/R1FICHRSDH8HZY/ref=cm_cr_arp_d_rvw_ttl?ie=UTF8&ASIN=B00XEW3YD6","https://www.amazon.com/gp/pdp/profile/A1SM3YUTM0C135/ref=cm_cr_arp_d_pdp?ie=UTF8"
"Jeff V",26-Dec-2016,5,"Get Eero!","This WiFi System is legit! Strong signal thru out the household and is easy to manage. Beats the repeaters we had before hands down.","https://www.amazon.com/gp/customer-reviews/R18Z3P3NDESKJE/ref=cm_cr_arp_d_rvw_ttl?ie=UTF8&ASIN=B00XEW3YD6","https://www.amazon.com/gp/pdp/profile/A3ME7G7ZM8PNRB/ref=cm_cr_arp_d_pdp?ie=UTF8"
"J. L. Coddington",26-Dec-2016,5,"Router Nirvana","Before eero, one of our computers would disconnect from WiFi frequently and we had occasional buffering issues with Netflix and Amazon Video on our smart televisions. I should also mention that In the last couple of years we've added two tablets, an Amazon Echo, an Echo Dot, a device that monitors our rooftop solar panels, a Joule sous vide, a Hue bridge and several WiFi-enabled LED light bulbs. Projecting that there will be more smart devices to come in the near future, we needed to act. After researching routers and router extenders, it was decided that the eero system would be our best option. A hefty price break sealed the deal and we purchased a three pack. Since the eero system was put into service to blanket the house, we've had no further connectivity issues. Installation was incredibly simple--all devices connected easily and they work as they are supposed to. As non-techies, automatic updates are a big plus; there is no wondering if our router is up-to-date (if it wasn't, we wouldn't have known how to update it anyway). Unlike our previous routers, eero's appearance is sleek and unobtrusive. We like our eero system so much that we will be ordering another one or two for our vacation home shortly.","https://www.amazon.com/gp/customer-reviews/R2G9OMEADO9ZM4/ref=cm_cr_arp_d_rvw_ttl?ie=UTF8&ASIN=B00XEW3YD6","https://www.amazon.com/gp/pdp/profile/AEN53KFZD8RYF/ref=cm_cr_arp_d_pdp?ie=UTF8"
"Thomas C. Masters",26-Dec-2016,5,"Would buy again","This is the first (and only) &#34;mesh&#34; network that I have purchased, so I cannot compare eero to its competitors in that category.  I had a traditional network set up using Apple routers and Netgear extenders and eero was a tremendous upgrade.First of all the set up was very simple using the app.  The app is easy to use and intuitive.  Setting up several units took less than 20 minutes.  When choosing eero, this was one of the factors that influenced my decision over Netgear's product in which the app appeared dated (at least at the time I'm writing this).Most importantly though is that eero just works.  I struggled with random dead spots all over my home (despite having repeaters literally 15 ft from the devices) and I am no longer having this issue.While certainly more expensive than many products, the product does what it's supposed to do and delivers coverage all over my house.","https://www.amazon.com/gp/customer-reviews/R1X37IGF6T3BV9/ref=cm_cr_arp_d_rvw_ttl?ie=UTF8&ASIN=B00XEW3YD6","https://www.amazon.com/gp/pdp/profile/AOOI9XQ4E1S93/ref=cm_cr_arp_d_pdp?ie=UTF8"
"Amazon Customer",26-Dec-2016,5,"Works great!","Works extremely well. Easy to set up. Solved my wifi problem. Highly recommend.","https://www.amazon.com/gp/customer-reviews/R29QJF2VBDK1ML/ref=cm_cr_arp_d_rvw_ttl?ie=UTF8&ASIN=B00XEW3YD6","https://www.amazon.com/gp/pdp/profile/AYOGR4917D5Y3/ref=cm_cr_arp_d_pdp?ie=UTF8"
"JohnDarden",26-Dec-2016,5,"Easy to set up","It's wifi that just works everywhere in the house.  Easy to set up, and the app is just a pleasant bonus","https://www.amazon.com/gp/customer-reviews/RZQ6W3BVKRLBU/ref=cm_cr_arp_d_rvw_ttl?ie=UTF8&ASIN=B00XEW3YD6","https://www.amazon.com/gp/pdp/profile/AXXOI0F680MCE/ref=cm_cr_arp_d_pdp?ie=UTF8"
"Ty H.",26-Dec-2016,5,"Works Great","Works great. Easy to set up. I get high speed wireless throughout my house (2 floors and a finished basement) with two Eero units. Wireless download speed (82 mps) is almost as fast as the wired connection (83 mps). Throughput to all local network connections (TV, Apple TV, PCs, set top boxes, etc.) was optimized after a day or so. The iPhone app is quite helpful for monitoring the status of the Internet connection as well as internal network connections. Highly recommend Eero.","https://www.amazon.com/gp/customer-reviews/RKYWLTW1QMH7Z/ref=cm_cr_arp_d_rvw_ttl?ie=UTF8&ASIN=B00XEW3YD6","https://www.amazon.com/gp/pdp/profile/A3KJV9R083ALZW/ref=cm_cr_arp_d_pdp?ie=UTF8"
"RYAN M ROBERTS",26-Dec-2016,5,"Transformative home WiFi system!","Amazing system, so easy to blanket the whole house with coverage, works wired or wireless, one SSID for the entire system, just an excellent product.","https://www.amazon.com/gp/customer-reviews/RLW6SIMV561NM/ref=cm_cr_arp_d_rvw_ttl?ie=UTF8&ASIN=B00XEW3YD6","https://www.amazon.com/gp/pdp/profile/A3B50QOPK4FCGR/ref=cm_cr_arp_d_pdp?ie=UTF8"
"Occasional Reviewer",26-Dec-2016,5,"Pricey, but super easy and super fast","This system has worked incredibly well.  It is certainly not cheap, but it seems to be a case of getting what you pay for: excellent performance and fast set up.  Setup relies on a simple iPhone app and was super simple.  The network performance has been flawless and fast.  However, two important notes: (1) it takes a couple days for the network to optimize itself, so be patient - mine was pretty fast out of the box, but a friend's eero network (in a taller house) improved by nearly 3X over the course of about 48 hours (2) you have to do the latest software updates for the best performance. Below are the performance numbers for my old Airport Extreme, followed by the eero without a patch and then the eero with the patch.","https://www.amazon.com/gp/customer-reviews/R2IQUVZP77WH7Z/ref=cm_cr_arp_d_rvw_ttl?ie=UTF8&ASIN=B00XEW3YD6","https://www.amazon.com/gp/pdp/profile/A2FD1XVWUV1MNG/ref=cm_cr_arp_d_pdp?ie=UTF8"
"mehmet",26-Dec-2016,1,"One Star","Beware if you own Arris Surfboard SB6183, due to some bugs wireless does not work","https://www.amazon.com/gp/customer-reviews/R2AEHW00HHG4OB/ref=cm_cr_arp_d_rvw_ttl?ie=UTF8&ASIN=B00XEW3YD6","https://www.amazon.com/gp/pdp/profile/A26D7F8OP96NUK/ref=cm_cr_arp_d_pdp?ie=UTF8"
"Lorraine Bell",26-Dec-2016,5,"Best Christmas Gift","Best Christmas Gift!  I researched many options and asked for the eero wifi system for Christmas.  It is SO simple to install.  I downloaded the app to my iPhone 7 and followed the instructions to set it up.  It was fast, easy and working in 20 minutes.  Most of the time installing was due to rebooting my modem/router from my cable company.  I tested it out by watching Amazon Prime where we had spotty wifi and it it worked like a charm!  It's only been 1 day, but so far I love it!","https://www.amazon.com/gp/customer-reviews/R2JJIR64R5XL2M/ref=cm_cr_arp_d_rvw_ttl?ie=UTF8&ASIN=B00XEW3YD6","https://www.amazon.com/gp/pdp/profile/A1CBZ35XB9UXCX/ref=cm_cr_arp_d_pdp?ie=UTF8"
"Amazon Customer",25-Dec-2016,5,"Great easy to use router","The system is really easy to set up and distributes the wifi signal to the entire house.  The ability to create profiles and set Internet pause times is great. I would like to be able to add a device to multiple profiles. I really like being able to check and manage the network from the app wherever I might be. I can see who is online and pause the xbox connection if they should be doing homework. I would recommend to anyone who wants a network router that you can just set up and forget for the most part but easy to configure when you do need to make a change.","https://www.amazon.com/gp/customer-reviews/R1T1T9TD8W2X/ref=cm_cr_arp_d_rvw_ttl?ie=UTF8&ASIN=B00XEW3YD6","https://www.amazon.com/gp/pdp/profile/A3GXFALIT96Y0Z/ref=cm_cr_arp_d_pdp?ie=UTF8"
"Jack McGuire",25-Dec-2016,2,"More my fault I think","It really didn't do what I was expecting. But not sure that the issue I have can be cured by this either.","https://www.amazon.com/gp/customer-reviews/R32O3V6RH29PKC/ref=cm_cr_arp_d_rvw_ttl?ie=UTF8&ASIN=B00XEW3YD6","https://www.amazon.com/gp/pdp/profile/A1G7WOOUO1HU69/ref=cm_cr_arp_d_pdp?ie=UTF8"
"Steve Travis",25-Dec-2016,5,"Works great! Order with confidence.","I'm not a technical guy. I either don't have the aptitude or the patience. I want to plug something in and have it work. Eero was simple to set up and works like a charm. This solved all of my home wifi coverage issues.","https://www.amazon.com/gp/customer-reviews/R22EQT9446SJQ0/ref=cm_cr_arp_d_rvw_ttl?ie=UTF8&ASIN=B00XEW3YD6","https://www.amazon.com/gp/pdp/profile/A7EPP2VMUZ3YG/ref=cm_cr_arp_d_pdp?ie=UTF8"
"Alexander Sade",25-Dec-2016,5,"Five Stars","Great product","https://www.amazon.com/gp/customer-reviews/R3ICJ38S2Q2GIM/ref=cm_cr_arp_d_rvw_ttl?ie=UTF8&ASIN=B00XEW3YD6","https://www.amazon.com/gp/pdp/profile/A1XPP5MXKH118G/ref=cm_cr_arp_d_pdp?ie=UTF8"
"Todd A Rose",25-Dec-2016,5,"Five Stars","Excellent, reliable, as easy as advertised.","https://www.amazon.com/gp/customer-reviews/RNVBS35SWXI5F/ref=cm_cr_arp_d_rvw_ttl?ie=UTF8&ASIN=B00XEW3YD6","https://www.amazon.com/gp/pdp/profile/AM5WT1HMUJ79C/ref=cm_cr_arp_d_pdp?ie=UTF8"
"G. Eric Dale",25-Dec-2016,5,"Don't even hesitate. This is a first class product with a great range.","Easy to set up. Fewer drops and black spots.","https://www.amazon.com/gp/customer-reviews/R2MDTEHDUDAVKL/ref=cm_cr_arp_d_rvw_ttl?ie=UTF8&ASIN=B00XEW3YD6","https://www.amazon.com/gp/pdp/profile/A3TYDOESHDT9NR/ref=cm_cr_arp_d_pdp?ie=UTF8"
"nwhiting",25-Dec-2016,5,"A+","great, as expected -- easy to set up and now we have ripping fast wifi in the whole loft apartment","https://www.amazon.com/gp/customer-reviews/R6WPB2SZNP96X/ref=cm_cr_arp_d_rvw_ttl?ie=UTF8&ASIN=B00XEW3YD6","https://www.amazon.com/gp/pdp/profile/A3I896CZ07WCBA/ref=cm_cr_arp_d_pdp?ie=UTF8"
"Jeff",25-Dec-2016,1,"Great Product - Sub Par Support","Two parts to this review.First part is the hardware. Hardware is beautiful looking, super easy to set up, performance is awesome for my home, and the attention to detail of the product is spectacular. You are purchasing a system of routers that will completely cover your home in reliable wifi coverage. It looks like a modern &#34;apple designed&#34; device and has a beautiful app that is iOS and android friendly. No support for a computer to set up and monitor the system though that's not a huge deal.Second part is the support of the purchase of the product. Support of this item lacks common sense. You might never know when to purchase this item. Buy it now. You might loose out on a promotion. Also the experience I received when asking for assistance. Here is the story about the experience with Eero and Amazon Customer Service. I bought this as a early adopter of the &#34;mesh network&#34; items full price 500 bucks. It went on promotion 2 days after receiving it. Called eero and was told that I needed to talk to the seller. Called Amazon and uncovered there is No Policy or support to give me the difference while keeping the product. Instead they told me to re-purchase to get the promo price, THIS IS Amazon Customer Service's solution...To have over 1k in charges until the other was returned for Realiable Wi-Fi. So I return it, and go to rebuy it.... It's off the special promotion I find. Called Amazon informed me there was/is nothing they can do is not on special. I was advised that I needed to wait to buy it again. They mentioned that if I would have bought a TV they could have helped me. So to recap. Bought the $500 3 pack. Had to return it. Lost money as I had to pay to return it. Tried to get the promotion again and it was off promo. In the mean time I am getting email from eeros marketing telling me that I can get 100 off and to purchase it today. Great customer focus Eero and Amazon.","https://www.amazon.com/gp/customer-reviews/R7KYEAL7NJTQA/ref=cm_cr_arp_d_rvw_ttl?ie=UTF8&ASIN=B00XEW3YD6","https://www.amazon.com/gp/pdp/profile/A254MYAPGHTBCV/ref=cm_cr_arp_d_pdp?ie=UTF8"
"Retired Engr",24-Dec-2016,5,"The 3 devices come well packaged and appear to be robustly built with a good quality finish","I have a 3 story condo and my wi fi wasn't reaching from the bottom to top floor.  I had tried a range extender and, while it allowed me to get an adequate signal where I added the extender, there were still a number of weak spots plus my devices wouldn't always change networks properly.  I read all the reviews on the eero system and finally decided to give it a try.  Most of the reviews I read have already hit the high points.  The 3 devices come well packaged and appear to be robustly built with a good quality finish.  I didn't have any issues setting up the devices using my iPhone; I was up and running in less than 30 minutes.  My signal strength/download rates were improved significantly throughout the house and now there is no need to switch networks since the mesh approach makes the devices look like one network.  After installation, I wanted to move one of the devices for improved coverage; so sent a test to eeros to make sure I knew how.  The response came shortly and it turned out you just unplug the device from its current location and plug it in in the new location; everything synchs up automatically.  I've been running for a couple of months now and everything is still working great.  I definitely would recommend this product.","https://www.amazon.com/gp/customer-reviews/R2THS4ORM7XNO2/ref=cm_cr_arp_d_rvw_ttl?ie=UTF8&ASIN=B00XEW3YD6","https://www.amazon.com/gp/pdp/profile/A1NIU2SLK53ZS/ref=cm_cr_arp_d_pdp?ie=UTF8"
"Amazon Customer",24-Dec-2016,5,"Five Stars","Simple setup. Intuitive app. Spotless coverage. Worth every penny.","https://www.amazon.com/gp/customer-reviews/R3QMZHMENGGYHZ/ref=cm_cr_arp_d_rvw_ttl?ie=UTF8&ASIN=B00XEW3YD6","https://www.amazon.com/gp/pdp/profile/A3L4L9A7T12BKC/ref=cm_cr_arp_d_pdp?ie=UTF8"
"David Marino",24-Dec-2016,2,"My Wi-Fi connections suck. I have called my ISP and everything is ...","I don't need any replies or comments:  I paid over $500.00 w/service plan for the 3-pack.  My Wi-Fi connections suck.  I have called my ISP and everything is fine on their end.  I should of stuck to my NETGEAR NIGHTHAWK router that I have had for several years; it worked better.  I wish I could get my money back (Been trying to call and reach a rep).  Also, I see that I could have bought it for $127.00 cheaper now...awesome.  I hope it works for others and you are successful.  My Upload/Download speeds on average 5.3/0.2!  They go offline several times a day.  I have to reboot my system at least 2-3 daily.  Good luck people!","https://www.amazon.com/gp/customer-reviews/RG3CR63G7YTC/ref=cm_cr_arp_d_rvw_ttl?ie=UTF8&ASIN=B00XEW3YD6","https://www.amazon.com/gp/pdp/profile/A14MKF07OY8YX0/ref=cm_cr_arp_d_pdp?ie=UTF8"
"Don Jones",24-Dec-2016,5,"They Just Work and Work Great","I purchased a three pack during the Black Friday sale ... the performance increase is awesome; back bedrooms went from under 10 MB to over 100 MB. Devices connected to the primary eero come in at over 300 MB. Total setup time including the initial software update for all three eeros took about 15 minutes.","https://www.amazon.com/gp/customer-reviews/R1LPIXZPM798AT/ref=cm_cr_arp_d_rvw_ttl?ie=UTF8&ASIN=B00XEW3YD6","https://www.amazon.com/gp/pdp/profile/AKH7OR9RR7HOD/ref=cm_cr_arp_d_pdp?ie=UTF8"
"RON O&#039;DELL",23-Dec-2016,5,"Revolutionary product!","OMG!  Buy Eero TODAY!  The easiest network setup I've EVER done!  Gives you a PERFECT wifi network!  Never seen anything this simple and effective!","https://www.amazon.com/gp/customer-reviews/R2RKVO93JZHXI2/ref=cm_cr_arp_d_rvw_ttl?ie=UTF8&ASIN=B00XEW3YD6","https://www.amazon.com/gp/pdp/profile/A1Z3YDCTJSYDML/ref=cm_cr_arp_d_pdp?ie=UTF8"
"Steve in Seattle",23-Dec-2016,5,"GREAT PRODUCT.  It works well.  It really delivers.  Get the 3-pack.","This product is GREAT.  We have a 5,000sq ft house on two levels.  For years we have had several access points in the home, and have relied on our mobile phones and tablets to lock on to the best one depending on what room we're in.  Stuttering videos, slow browsing, and sometimes just no access are problems we've had through several versions of this kind of setup.  FINALLY, I sprung for a 3-pack of these, and I can tell you, I have FULL BARS IN EVERY CORNER OF THE HOUSE.  It really does work as advertised.  If you have the problems I've mentioned, you should get a set of these and all that will be history.  I'm a licensed ham radio operator, and I was skeptical, but this actually does what you think it is supposed to do.","https://www.amazon.com/gp/customer-reviews/R19YVALBIXNA1G/ref=cm_cr_arp_d_rvw_ttl?ie=UTF8&ASIN=B00XEW3YD6","https://www.amazon.com/gp/pdp/profile/A3S3VPJ3HAA6MS/ref=cm_cr_arp_d_pdp?ie=UTF8"
"Gonzalo Alberto Gomez A",23-Dec-2016,5,"Beyond simplicity","Beyond simplicity, finally, something that really work an Erro solved in the most simple (Not cheap but no expensive).I'm so glad to have been bought eero devices and it was not just for me, my wife loved it; she is not technical and not having to switch between 6 different networks around my house is fantastic for her and I don't have to provide technical support for everyone anymore and I don't have to explain why I have so many WIFI networks :).","https://www.amazon.com/gp/customer-reviews/R36CJAHBZNLQDN/ref=cm_cr_arp_d_rvw_ttl?ie=UTF8&ASIN=B00XEW3YD6","https://www.amazon.com/gp/pdp/profile/A37NCBYELSXPJD/ref=cm_cr_arp_d_pdp?ie=UTF8"
"Donna",23-Dec-2016,5,"Great product!","Great product! Easy to set up and very reliable. Highly recommend.","https://www.amazon.com/gp/customer-reviews/R347W7R048A2HN/ref=cm_cr_arp_d_rvw_ttl?ie=UTF8&ASIN=B00XEW3YD6","https://www.amazon.com/gp/pdp/profile/A3LBHYKZRCEHND/ref=cm_cr_arp_d_pdp?ie=UTF8"
"Mark Christensen",23-Dec-2016,5,"Great coverage in our 2 story house","Great coverage in our 2 story house. The only downside is the price.I like the new Family Profile feature. It lets you easily schedule off times for the kid's devises without disabling the whole internet. It also lets you disable & enable their internet on the fly if they are not doing homework.","https://www.amazon.com/gp/customer-reviews/R1JHX5DA4VD0RE/ref=cm_cr_arp_d_rvw_ttl?ie=UTF8&ASIN=B00XEW3YD6","https://www.amazon.com/gp/pdp/profile/A17S40KYYJKYCO/ref=cm_cr_arp_d_pdp?ie=UTF8"
"Todd",23-Dec-2016,1,"Mine are BLIND","two (z)-eeros 20 feet away, up on bookshelves, couldn't see each other. For the price, they should connect and make me a cuppa coffee besides. Worthless in my hands. Have the ORBI (at home), and send this back for my second ORBI.","https://www.amazon.com/gp/customer-reviews/RYBG1ESJR9C78/ref=cm_cr_arp_d_rvw_ttl?ie=UTF8&ASIN=B00XEW3YD6","https://www.amazon.com/gp/pdp/profile/A186WJVU26CAM8/ref=cm_cr_arp_d_pdp?ie=UTF8"
"Lyn H. Oliver",23-Dec-2016,5,"A whole new wifi!!","Super easy to set up! We now have no wifi dead zones in our home. Streaming is much much faster everywhere!","https://www.amazon.com/gp/customer-reviews/R2I5NRR2K3QFKO/ref=cm_cr_arp_d_rvw_ttl?ie=UTF8&ASIN=B00XEW3YD6","https://www.amazon.com/gp/pdp/profile/A2EPS04T6G7I8C/ref=cm_cr_arp_d_pdp?ie=UTF8"
"Bryon Larrance",23-Dec-2016,3,"Not fully compatible with WeMo","Here's the good.Considerably faster wi-if than running airport extremes as extenders.Easy to set-up.Worked great with our Wink hub and door locks.Here's the bad and why we returned them.Not fully compatible with WeMo.After spending a total of 8hrs on support and troubleshooting with WeMo and Eero our insight WeMo switches never worked.  The other WeMo products worked half the time.","https://www.amazon.com/gp/customer-reviews/R3E7C07DPIJU2A/ref=cm_cr_arp_d_rvw_ttl?ie=UTF8&ASIN=B00XEW3YD6","https://www.amazon.com/gp/pdp/profile/AR799K4TO1VFV/ref=cm_cr_arp_d_pdp?ie=UTF8"
"JLA76",23-Dec-2016,3,"Not the end-all","Eero talks as if these are going to be the greatest thing ever. That's just simply not the case. Ultimately, these are just normal wifi access points. They didn't go through everything, like they said they would; they didn't just instantly handle themselves, like they said they would; I ended up having to hardwire all three of mine, and put them into bridge mode to work with my Fiber. Outside of that, they work fine. But, I could have done this with my old Apple WAPs.","https://www.amazon.com/gp/customer-reviews/R2DPMDYFTU5HEO/ref=cm_cr_arp_d_rvw_ttl?ie=UTF8&ASIN=B00XEW3YD6","https://www.amazon.com/gp/pdp/profile/A3BA8K7TBI43OH/ref=cm_cr_arp_d_pdp?ie=UTF8"
"TMB",22-Dec-2016,5,"Five Stars","Works as expected. Just a townhouse but made a difference with multiple users and multiple devices using the Internet","https://www.amazon.com/gp/customer-reviews/R8EGU8CV8NPM7/ref=cm_cr_arp_d_rvw_ttl?ie=UTF8&ASIN=B00XEW3YD6","https://www.amazon.com/gp/pdp/profile/A2KH3AXX5S3VOS/ref=cm_cr_arp_d_pdp?ie=UTF8"
