Username,Date,Star Rating,Title,Review Comment,Review Link,User Profile Link
"L. D. Weller",15-Apr-2017,5,"Very happy with purchase","Finally my family is no longer complaining about WiFi access speeds.  Compared to Small Office/Home Office routers which I've purchased over the years this product was easy to set up and configure and works reliably. Very happy and have recommended it to co-workers and friends who have family embers frustrated with lack of signal in some parts of the house.  I was a little concerned about maintaining enough bandwidth for VOIP but have had no problems so far.","https://www.amazon.com/gp/customer-reviews/RR14Q259GDYT2/ref=cm_cr_arp_d_rvw_ttl?ie=UTF8&ASIN=B00XEW3YD6","https://www.amazon.com/gp/pdp/profile/AYDSCPPWPXF9S/ref=cm_cr_arp_d_pdp?ie=UTF8"
"Baradanikto",15-Apr-2017,5,"Replacement for Three TP-Link range extenders","I bought the three unit mesh network to replace three TP-Link POE range extenders.  The range extenders would occasionally drop signals and force me to use a different SSID when I needed a better signal (depending upon the location).  The eero units worked out of the box and provided much better and stronger coverage than the range extenders.  Setup was easy using my Android smartphone.  The only problem I had was with my  Canon wireless printer.  The eero installation sets up a new network with a different IP address scheme.  After installation, I could no longer print because the printer was not &#34;discovered&#34;.  I had to reset the printer settings and re-install the drivers after pulling the plugs on two eero units.  I needed to pull the plugs because the eero units use the same SSID for each unit.  The printer install would not let me install initially because of the duplicate SSIDs.  Temporarily removing two eero units allowed me to connect the printer to a single unit and finish the install.  Once the printer install was done, I re-plugged the two units and all is well.","https://www.amazon.com/gp/customer-reviews/R2EMNXRZICW3O8/ref=cm_cr_arp_d_rvw_ttl?ie=UTF8&ASIN=B00XEW3YD6","https://www.amazon.com/gp/pdp/profile/A7KCAN9VNVOBX/ref=cm_cr_arp_d_pdp?ie=UTF8"
"RoadRage",14-Apr-2017,4,"Your mileage may vary","I struggle w/ 4 or 5 stars. I am a engineer and my network maybe was a bit different then the intended audience and I want to be fair if this is at all the cause for my challenges. That being said, if you are looking for a simple to use wifi mesh that will cover a large square footage home, this is a great product and dead simple to install. My only complaint is after initial install the app stated that &#34;Everything Looks Good&#34; although I was unable to pass traffic from any wireless connected device. It was not until I went into &#34;Help--&#62;My Internet is slow--&#62;Run Health Check&#34; that there was a sign of an issue. I just found this very misleading and as a technical person I did know howto logically troubleshoot but would my friend or family member or would this be a call to the guy who recommends it, me ? The other issue was an undocumented feature that suddenly appeared after a software update that now my wireless devices can not converse with my wired devices, this presents an issue because my wired device is my desktop/media server and now none of my devices can do app hand off in spotify to my desktop.  Another EXCELLENT win for this solution is support, I spoke with a girl who was extremely knowledgeable and courteous and would say this is the best consumer network device support in the industry right now.  Please keep in mind, if you have a very simple cable modem and wireless setup, you may have no issues but I have a cable modem, router, switch, wired VoIP, wired desktops, and now Eero for wifi and there are some challenges.","https://www.amazon.com/gp/customer-reviews/R28HK5MKP0EFZW/ref=cm_cr_arp_d_rvw_ttl?ie=UTF8&ASIN=B00XEW3YD6","https://www.amazon.com/gp/pdp/profile/ALM31S9O8EWW/ref=cm_cr_arp_d_pdp?ie=UTF8"
"David",14-Apr-2017,1,"Issue with Arris 6183 cable modem","Incompatible with Arris 6183 cable modem.  Major issue, not disclosed.  Serious pain to deal with.","https://www.amazon.com/gp/customer-reviews/R1R5A9RV92AYET/ref=cm_cr_arp_d_rvw_ttl?ie=UTF8&ASIN=B00XEW3YD6","https://www.amazon.com/gp/pdp/profile/A2JO1ISRDWTQ43/ref=cm_cr_arp_d_pdp?ie=UTF8"
"David D.",14-Apr-2017,5,"OMG. It was worth it.","Our wi-fi throughout the house is SO much better. This was a great purchase.","https://www.amazon.com/gp/customer-reviews/RD54VCM7B8ZA2/ref=cm_cr_arp_d_rvw_ttl?ie=UTF8&ASIN=B00XEW3YD6","https://www.amazon.com/gp/pdp/profile/A2D1X1OVO62SHK/ref=cm_cr_arp_d_pdp?ie=UTF8"
"Marti",13-Apr-2017,5,"Greatly improved wifi coverage","Using the 3 eero set up we have excellent wifi coverage in our 2 story house plus separate guest house. Very much better than the prior wifi solution with a modem/router and separate wifi extender. Much stronger and now not requiring different and confusing connections and passwords.","https://www.amazon.com/gp/customer-reviews/R303SY1U8SY89M/ref=cm_cr_arp_d_rvw_ttl?ie=UTF8&ASIN=B00XEW3YD6","https://www.amazon.com/gp/pdp/profile/A3EONUYR72XTRG/ref=cm_cr_arp_d_pdp?ie=UTF8"
"yaritomo",13-Apr-2017,5,"Wow.","Attractive industrial design, fantastic software UI/UX, easy setup, rock-solid reliability and performance. This blows traditional routers out of the water and I'm amazed. You can tell the product was made by people who care and were out to solve once and for all the headaches of home wifi systems. Might be a bit overkill for smaller homes/apartments, but worth every penny in terms of performance and peace of mind.","https://www.amazon.com/gp/customer-reviews/R385GOR84FFYMB/ref=cm_cr_arp_d_rvw_ttl?ie=UTF8&ASIN=B00XEW3YD6","https://www.amazon.com/gp/pdp/profile/A1H16A8EHEFBM1/ref=cm_cr_arp_d_pdp?ie=UTF8"
"adee",12-Apr-2017,5,"Happy with Eero","Was comparing Linksys Velop, Orbi and Eero, I haven't actually tried the products but basically decided based on one factor, the size. The reviews are pretty much the same for all of them, solid wifi that blankets your home. So I got the Eero and yes, they kinda hide on my bookshelf along with my books, can't even notice it, set up was super easy, I now have fast blazing speed connection without interruption everywhere in my house, even in my driveway:)","https://www.amazon.com/gp/customer-reviews/R1OOXY7GN3NY0D/ref=cm_cr_arp_d_rvw_ttl?ie=UTF8&ASIN=B00XEW3YD6","https://www.amazon.com/gp/pdp/profile/A1M5N5F5ZET4HE/ref=cm_cr_arp_d_pdp?ie=UTF8"
"Lily",12-Apr-2017,5,"Works great, as advertised.","fully met my expectations; after poor performance of my previous router, the eero system (3) took care of everything that may have been impacting  me before.  make sure you follow the instructions in the app all the way to the end, I did not and thus the systems was not fully set up; I contacted support when there was a mismatch of versions between software in the eero modules.  Support was excellent.","https://www.amazon.com/gp/customer-reviews/RO9JGDSF6T9XA/ref=cm_cr_arp_d_rvw_ttl?ie=UTF8&ASIN=B00XEW3YD6","https://www.amazon.com/gp/pdp/profile/A1HEHA2QIUKO34/ref=cm_cr_arp_d_pdp?ie=UTF8"
"Adam",12-Apr-2017,5,"Mesh is the answer","I think we all know the problems with traditional consumer wifi routers. The interface is complicated, it has to be re-booted periodically, and it doesn't cover your whole home. I am so happy with my new Eero wifi system. The set up is VERY easy. Been dreaming of something like this since I got my first 14.4k baud dial-up modem.","https://www.amazon.com/gp/customer-reviews/R10T6A7IDE6A9E/ref=cm_cr_arp_d_rvw_ttl?ie=UTF8&ASIN=B00XEW3YD6","https://www.amazon.com/gp/pdp/profile/A2EIE0I7QM40LJ/ref=cm_cr_arp_d_pdp?ie=UTF8"
"D300Dave",12-Apr-2017,5,"Well Worth the Money!","We stopped renting the cable company modem and bought our own gateway connected to the eeros and we couldn't be happier!  We have 13 devices connected via wifi and run streaming music or video over 3 or 4 at the same time with no lag or interruption.  Moreover, our internet speed went from 20 Mbps to 50 - well worth the money!","https://www.amazon.com/gp/customer-reviews/R2TI5DBMXHGKHK/ref=cm_cr_arp_d_rvw_ttl?ie=UTF8&ASIN=B00XEW3YD6","https://www.amazon.com/gp/pdp/profile/A32CYCE2CHD9ZY/ref=cm_cr_arp_d_pdp?ie=UTF8"
"Dennis A. Hasko",12-Apr-2017,5,"Five Stars","This is a great product. We now well connected throughout the house.","https://www.amazon.com/gp/customer-reviews/R1ILEN64VK33G1/ref=cm_cr_arp_d_rvw_ttl?ie=UTF8&ASIN=B00XEW3YD6","https://www.amazon.com/gp/pdp/profile/A1PCPSFH2G46TE/ref=cm_cr_arp_d_pdp?ie=UTF8"
"Steve",11-Apr-2017,5,"Great product!","Works great and easy to set up. I called support because I had to set mine up differently than the default and someone answered the phone immediately with no waiting! The support person communicated clearly and was actually knowledgeable about the product. No sh... er, I mean, no kidding!!  Maybe I got lucky but so far this product is 5 BRIGHT stars!","https://www.amazon.com/gp/customer-reviews/R12FUZSWX8LFQV/ref=cm_cr_arp_d_rvw_ttl?ie=UTF8&ASIN=B00XEW3YD6","https://www.amazon.com/gp/pdp/profile/A29GBQOD27JZLL/ref=cm_cr_arp_d_pdp?ie=UTF8"
"LMS",11-Apr-2017,5,"Pricey BUT so worth every penny!","SUPER easy to install. A package of 3 was perfect for our 2 story house.  One got directly connected to modem.  The other in main living room (for our Roku & gaming systems) and the last one went upstairs.  Created a nice mesh & we can see the difference.  Movies stream in Ultra HD 4K no prob.  A lil pricey, which hurt but the end result is awesome!","https://www.amazon.com/gp/customer-reviews/R2RCO7C5B1OC7Q/ref=cm_cr_arp_d_rvw_ttl?ie=UTF8&ASIN=B00XEW3YD6","https://www.amazon.com/gp/pdp/profile/AZBBNI01RYR35/ref=cm_cr_arp_d_pdp?ie=UTF8"
"Kacy A.",11-Apr-2017,5,"Great product. Very easy to use","So far so good. I installed this in my boss' house. 9 bedroom, god knows how many sq feet. I replaced his apple airport stuff which was very spotty. It took nearly 3 mins to connect music to his 18 sonos speakers from an iPad before with airport set up (1 airport, 2 airport express'). I replaced all the apple stuff with an eero exactly where they were and not only is it instant to play music, but I would lose the groups all the time due to spotty connectivity atleast once a week, I haven't lost the groups in months.","https://www.amazon.com/gp/customer-reviews/RILPG1CD84R44/ref=cm_cr_arp_d_rvw_ttl?ie=UTF8&ASIN=B00XEW3YD6","https://www.amazon.com/gp/pdp/profile/A2BTAJ5FIT8S9X/ref=cm_cr_arp_d_pdp?ie=UTF8"
"Chris Lara",11-Apr-2017,5,"Bought the eero WiFi System and the whole house is covered with better than expected speed","Had an Apple AirPort Time Capsule which didn't cover two-stories at about 2,700 SF very well.  Bought the eero WiFi System and the whole house is covered with better than expected speed.  Download the iOS app for step-by-step walk through.  Tip:  Use the same network name and password and all the devices connect with ease.  Worth every dollar.  Now all four members of the family are happy and connected in all rooms in the house.  TVs, Macs, PCs, smartphones, game consoles, etc.","https://www.amazon.com/gp/customer-reviews/R3B7010LIF3GCN/ref=cm_cr_arp_d_rvw_ttl?ie=UTF8&ASIN=B00XEW3YD6","https://www.amazon.com/gp/pdp/profile/A3ST5XCQH50ICG/ref=cm_cr_arp_d_pdp?ie=UTF8"
"jeff engwall",10-Apr-2017,5,"If Consumer Reports likes a product it's a good product. I bought it on their recommendation","Not a computer headed geek, don't really understand all the computer jabber. I read about this product in Consumer Reports- only a few things you can always depend on in this nation today, the Military, Consumer Reports, and Toyota. If Consumer Reports likes a product it's a good product. I bought it on their recommendation, it works well, no more dead spots. Not a large house but rooms are small with many walls to block signals. Dead spots gone! A product that works as claimed.","https://www.amazon.com/gp/customer-reviews/R2IDFZ7GAML8I9/ref=cm_cr_arp_d_rvw_ttl?ie=UTF8&ASIN=B00XEW3YD6","https://www.amazon.com/gp/pdp/profile/A3FL3Q1EDITEX/ref=cm_cr_arp_d_pdp?ie=UTF8"
"Tiff",10-Apr-2017,5,"Best flipping WiFi ever!","The best I've ever had! I've always had problems with updates and firmware for years with all the big brand name &#34;disposable&#34; routers. I call them disposable because that's exactly what they are and I've gone through so many. Finally, Eero has nailed it! I've had the router for months now and it's connectivity is unfailing and superior, and fast! Hallelujah brother that created it! Love the app that works with the router, too. I bought only one because I live in an apartment.","https://www.amazon.com/gp/customer-reviews/R2D7WZXADZXQLQ/ref=cm_cr_arp_d_rvw_ttl?ie=UTF8&ASIN=B00XEW3YD6","https://www.amazon.com/gp/pdp/profile/A38GJ6Q9IWCZO9/ref=cm_cr_arp_d_pdp?ie=UTF8"
"wsconn1",09-Apr-2017,4,"Set up was very easy. The only problem I had was that after ...","These appear to have resolved a problem of spotty wifi around my house.  Set up was very easy.  The only problem I had was that after getting these set up, they auto-updated the software and the app got frozen -- although the eeros themselves were working.  I finally deleted the app and reinstalled it and everything has been good since then.  I am surprised that I do get an occasional message when trying to use my iPad and my Apple TV, both in the same room as an eero, telling me that the signal is too weak.  There is a clear line of sight between all three devices and the Apple TV is close to the eero but a bit lower.  I'll experiment a bit with placement and assume this will be resolved.  Regardless, I would recommend these because of the design, ease of set up and blanket coverage elsewhere in my house.","https://www.amazon.com/gp/customer-reviews/R367T67OMQQIWF/ref=cm_cr_arp_d_rvw_ttl?ie=UTF8&ASIN=B00XEW3YD6","https://www.amazon.com/gp/pdp/profile/AH6CRBKET7IFC/ref=cm_cr_arp_d_pdp?ie=UTF8"
"Teri A. Moseley",08-Apr-2017,5,"Exceeds expectations","We live in a 3-level, 4K+ sqft house.  The 3-pack has eliminated all dead spots.  The interface allows me to see who is using my system and then block them if I so choose.  We run mostly Apple devices and an Xbox seamlessly.  I installed this last October and have seen it improve over that time from initial download speeds in the 30-40s to what we have now.  Our download speeds after the last update are consistently over 100Mbps.  The system does seem to &#34;learn&#34; your house.","https://www.amazon.com/gp/customer-reviews/R1KIYO1AFDF9EP/ref=cm_cr_arp_d_rvw_ttl?ie=UTF8&ASIN=B00XEW3YD6","https://www.amazon.com/gp/pdp/profile/A3SG0K9JFSJZ57/ref=cm_cr_arp_d_pdp?ie=UTF8"
"Don W.",07-Apr-2017,2,"Overheating eero units","The set I received was very easy to setup, and it worked great... for the first day. The next day I woke to find one of the units had overheated so I returned the set. I read online that everyone says they are very warm when on so I decided not to risk future failures and have decided to try the Linksys Velop system. Maybe when eero comes out with version 2 they will put in a better heatsink. I think they concentrated too much on aesthetics and not enough on functionality.","https://www.amazon.com/gp/customer-reviews/RQIHV7R8NN8QM/ref=cm_cr_arp_d_rvw_ttl?ie=UTF8&ASIN=B00XEW3YD6","https://www.amazon.com/gp/pdp/profile/A1MYW26YJUP8Z8/ref=cm_cr_arp_d_pdp?ie=UTF8"
"Tom Bruning",07-Apr-2017,5,"My download speed is considerably better throughout our condo","This system does all it says it will.  My download speed is considerably better throughout our condo.  We now have no dead zones, and moving between rooms doesn't cause connection problems.  It is easy to set up, and configure, and so far I have gotten 2 software updates, something I never got with Linksys.","https://www.amazon.com/gp/customer-reviews/RJ6YJLHH5AKLS/ref=cm_cr_arp_d_rvw_ttl?ie=UTF8&ASIN=B00XEW3YD6","https://www.amazon.com/gp/pdp/profile/A2G2070DIMWE7P/ref=cm_cr_arp_d_pdp?ie=UTF8"
"Amazon Customer",07-Apr-2017,5,"Five Stars","Easy to install and works extremely well.  Replaced all previous wifi routers.","https://www.amazon.com/gp/customer-reviews/RJ67L0XPL0MAE/ref=cm_cr_arp_d_rvw_ttl?ie=UTF8&ASIN=B00XEW3YD6","https://www.amazon.com/gp/pdp/profile/ABLN7LFZ0SLE2/ref=cm_cr_arp_d_pdp?ie=UTF8"
"Gary Kean",07-Apr-2017,5,"Great product, great Wifi coverage, easy to set up","Finally, no dead spots in my house!  I've tried many products to cover my 5000 sp ft two story home, but there were always dead spots.  Not any more.  after spending about 30 minutes experimenting with locations for my FOUR Eero's, I finally have whole house coverage without any dead spots.  It was very easy to set up and requires zero maintenance or updating so far (3 months).  It was worth spending nearly $000 to have zero Wifi headaches.","https://www.amazon.com/gp/customer-reviews/RF4G89JVU0053/ref=cm_cr_arp_d_rvw_ttl?ie=UTF8&ASIN=B00XEW3YD6","https://www.amazon.com/gp/pdp/profile/A10V3AEA4MZ97J/ref=cm_cr_arp_d_pdp?ie=UTF8"
"Sharon M Henderson",06-Apr-2017,5,"Best purchase ever","Best purchase ever!!! No more connection issues. I live in an apartment complex its clean and I get to laugh at my neighbors who continue to buy extenders for their 2 bedroom units. Lol","https://www.amazon.com/gp/customer-reviews/R2NJ4KDFKG99MM/ref=cm_cr_arp_d_rvw_ttl?ie=UTF8&ASIN=B00XEW3YD6","https://www.amazon.com/gp/pdp/profile/ATPWPKBWUKB8U/ref=cm_cr_arp_d_pdp?ie=UTF8"
"Christopher Michael",06-Apr-2017,1,"Garbage.","Garbage. I bought 5 to cover our whole house (5k square feet). constantly needing to be reset. eero support is no help. plugged in old asus and everything works flawlessly.","https://www.amazon.com/gp/customer-reviews/R1JO27KFH3XV7K/ref=cm_cr_arp_d_rvw_ttl?ie=UTF8&ASIN=B00XEW3YD6","https://www.amazon.com/gp/pdp/profile/A2M94PHHT4WOAV/ref=cm_cr_arp_d_pdp?ie=UTF8"
"Mark Nadel",06-Apr-2017,5,"Great easy-to-use wi-fi network","This has made wi-fi almost as fast and easy as wired service.  For the first time, I have very fast and uniform wi-fi service in our large old house.  The system was easy to install.  When I did have a glitch, I was able to get eero tech support on the phone quickly and talk to a very helpful real human being.  He guided me through resolution in just a few minutes.  This is a great device from a customer-friendly business.","https://www.amazon.com/gp/customer-reviews/R3FAZ9W4DPENK1/ref=cm_cr_arp_d_rvw_ttl?ie=UTF8&ASIN=B00XEW3YD6","https://www.amazon.com/gp/pdp/profile/A3RD1H3GXPE99S/ref=cm_cr_arp_d_pdp?ie=UTF8"
"Shelley",05-Apr-2017,5,"Excellent wifi system and excellent customer service.","Installed eeros in both our apartment and a vacation home. Both have multiple levels. In general only one is needed on each floor. The system works perfectly in both locations. Streaming is flawless. I had a problem with the installation of one of the units. Called customer service and a lovely woman walked me thru a fix. She stayed on the phone with me until we were sure it was working.","https://www.amazon.com/gp/customer-reviews/R3W098FDMRJL1I/ref=cm_cr_arp_d_rvw_ttl?ie=UTF8&ASIN=B00XEW3YD6","https://www.amazon.com/gp/pdp/profile/A1FXCNWOW5FGP0/ref=cm_cr_arp_d_pdp?ie=UTF8"
"D. E. Bedwell",05-Apr-2017,4,"Works great. Great coverage across my house and yard","I've had this for about 6 months now.  Works great.  Great coverage across my house and yard, and stable as a rock.I had a problem early on where some devices would just momentarily disconnect from the wifi and then reconnect (and page loads and stuff would time-out in between).  It was annoying, and started getting more frequent.  I contacted support, and they were very responsive.  They reported back that one of the units was reporting that it was overheating indicating that it might be defective, so they sent me a replacement unit for it.  That resolved my problem.Its a good product and service has been good, and overall I am satisfied with it, but its still pretty dang expensive for what it is (hence the 4 stars).","https://www.amazon.com/gp/customer-reviews/R3MBF4ABREP76T/ref=cm_cr_arp_d_rvw_ttl?ie=UTF8&ASIN=B00XEW3YD6","https://www.amazon.com/gp/pdp/profile/A2DBVZP81CE00K/ref=cm_cr_arp_d_pdp?ie=UTF8"
"Danielea U. Perrella",04-Apr-2017,5,"Awesomeness in a small package.","If you are looking to create a home network and get coverage throughout your whole house this is the tool for you. They are literally the size of a small piece of sandwich bread that is overstuffed with fillings. We have had great coverage and increased the ability our internet to handle more devices. Yes we have the almighty (crappy) Spectrum formally time warner cable.","https://www.amazon.com/gp/customer-reviews/R2P33UTFH7E91F/ref=cm_cr_arp_d_rvw_ttl?ie=UTF8&ASIN=B00XEW3YD6","https://www.amazon.com/gp/pdp/profile/A11Q3AWATYQF7P/ref=cm_cr_arp_d_pdp?ie=UTF8"
"Salieri",04-Apr-2017,5,"Fantastic","Great product. Exceeded expectations.","https://www.amazon.com/gp/customer-reviews/R2U9RG15S2XJ8U/ref=cm_cr_arp_d_rvw_ttl?ie=UTF8&ASIN=B00XEW3YD6","https://www.amazon.com/gp/pdp/profile/A26XE5DHKP5K92/ref=cm_cr_arp_d_pdp?ie=UTF8"
"Mrresurface",03-Apr-2017,5,"Just an Amazing product!","Simply amazing.  Easy to set up.  I did need to hard wire my first two eeros to each other.  Going from the main eero downstairs to the others upstairs rendered a weak signal, but hard wiring it was worth it.  I'm getting over 200mb in my past deads spots, such as the master bed room and deck, which makes this purchase worth the money as it works and communicates with itself to keep working and it did not interfere with my TV downstairs I have hard wired to the xfinity modem.  I read of Issues with LUMA having issues with existing hardwired connecitons.","https://www.amazon.com/gp/customer-reviews/R367T8KFJYM2PZ/ref=cm_cr_arp_d_rvw_ttl?ie=UTF8&ASIN=B00XEW3YD6","https://www.amazon.com/gp/pdp/profile/A1BSKYMAIYMY1G/ref=cm_cr_arp_d_pdp?ie=UTF8"
"Mikey T.",03-Apr-2017,5,"Best tech purchase ever!","Best tech purchase ever! So easy to use and the tech support was amazing when things were a bit slow after a network update!","https://www.amazon.com/gp/customer-reviews/R26VWXTSDT4C3Z/ref=cm_cr_arp_d_rvw_ttl?ie=UTF8&ASIN=B00XEW3YD6","https://www.amazon.com/gp/pdp/profile/ALLD11ERD47OY/ref=cm_cr_arp_d_pdp?ie=UTF8"
"Stupendo",03-Apr-2017,5,"Easy, immediate solution to my wifi woes!","After an amazingly simple and Apple-like setup, my wifi issues were solved. No more dropoffs and inconsistent speed. I was finally getting the wifi I was paying for. I'm using a 2 device system in a 1300 square foot home.","https://www.amazon.com/gp/customer-reviews/RPIVHZIF1VG0T/ref=cm_cr_arp_d_rvw_ttl?ie=UTF8&ASIN=B00XEW3YD6","https://www.amazon.com/gp/pdp/profile/A290W6287V6VL6/ref=cm_cr_arp_d_pdp?ie=UTF8"
"JC Briard",03-Apr-2017,5,"Very good system. After years of frustration with wifi coverage ...","Very good system. After years of frustration with wifi coverage in my house Eero has finally solved the problem and I no longer have wifi &#34;dead zones&#34;. Extremely easy to install and worked straight out of the box. Highly recommend this product.","https://www.amazon.com/gp/customer-reviews/R1WABRHAXHCAHQ/ref=cm_cr_arp_d_rvw_ttl?ie=UTF8&ASIN=B00XEW3YD6","https://www.amazon.com/gp/pdp/profile/A1DOF8VD1DULR6/ref=cm_cr_arp_d_pdp?ie=UTF8"
"Neil",03-Apr-2017,5,"eero rocks!","After years of frustration trying to get wifi through out my old three story house, I actually hired an audio guy thinking a professional could finally solve my problem. He was the one who suggested eero. And, he said: &#34;why not install it yourself?&#34; I took the leap and order the three pack that came neatly boxed with easy--very easy--to follow directions. In a matter of minutes after installing the app and plugging in the three units, I was up and running. I haven't looked back since. We have consistent wifi throughout the house.","https://www.amazon.com/gp/customer-reviews/RWDRYXYAMRTTQ/ref=cm_cr_arp_d_rvw_ttl?ie=UTF8&ASIN=B00XEW3YD6","https://www.amazon.com/gp/pdp/profile/A2427NHUVVGTOO/ref=cm_cr_arp_d_pdp?ie=UTF8"
"David Hopkins",02-Apr-2017,5,"Five Stars","like","https://www.amazon.com/gp/customer-reviews/R2KQDQLXDW2XXX/ref=cm_cr_arp_d_rvw_ttl?ie=UTF8&ASIN=B00XEW3YD6","https://www.amazon.com/gp/pdp/profile/A2D155XZ3DZVGM/ref=cm_cr_arp_d_pdp?ie=UTF8"
