Username,Date,Star Rating,Title,Review Comment,Review Link,User Profile Link
"C. M. Torgeson",18-Oct-2016,3,"Ok.  Not that great.","Family profiles often fail to work.  If you are counting on this product to limit your kids' computer time, it doesn't work all the time.  I would say maybe 20% of the time.You cannot setup this product without a phone and data connection unless you phone help.Speeds reported by the app are ludicrous and are probably pipelined isp tests. At your device i get about 10mbs despite the app report saying &#62; 100 mbs.","https://www.amazon.com/gp/customer-reviews/R2AC9YO7DHC4KE/ref=cm_cr_arp_d_rvw_ttl?ie=UTF8&ASIN=B00XEW3YD6","https://www.amazon.com/gp/pdp/profile/A3AMB7ORE1F3A8/ref=cm_cr_arp_d_pdp?ie=UTF8"
"Ian Rosenfield",18-Oct-2016,5,"It was easy to set up","It was easy to set up, and it's easy to keep an eye on the network with the app. I now get coverage throughout my entire house.","https://www.amazon.com/gp/customer-reviews/R2V1ZBO6GHTQ7D/ref=cm_cr_arp_d_rvw_ttl?ie=UTF8&ASIN=B00XEW3YD6","https://www.amazon.com/gp/pdp/profile/A1EIDW8D3F3XY7/ref=cm_cr_arp_d_pdp?ie=UTF8"
"Robert E McCarroll",18-Oct-2016,5,"I loved it. It works great","I loved it. It works great. I get download and upload speeds near my service ratings. It was easy to setup. I can move throughout the house and stay connected.","https://www.amazon.com/gp/customer-reviews/R9XUPRXXQ19VG/ref=cm_cr_arp_d_rvw_ttl?ie=UTF8&ASIN=B00XEW3YD6","https://www.amazon.com/gp/pdp/profile/A2MXDBZ4Q8452W/ref=cm_cr_arp_d_pdp?ie=UTF8"
"Larry Scott",18-Oct-2016,5,"Expensive and worth every penny","Super simple to install and configure.  Yeah, a bit pricey but given I wasted some money and enormous amounts of time with range extenders, more powerful wireless routers, etc. I was happy to plunk down the dough.  Apple like simplicity (or Amazon Echo).  My only wish is that I had known about the product or it was available 12 months ago!","https://www.amazon.com/gp/customer-reviews/R39C6IKG7H9P1T/ref=cm_cr_arp_d_rvw_ttl?ie=UTF8&ASIN=B00XEW3YD6","https://www.amazon.com/gp/pdp/profile/A28GP6IP8O45DA/ref=cm_cr_arp_d_pdp?ie=UTF8"
"James Taylor",18-Oct-2016,5,"Great results","My install provided all the coverage I hoped for and the steps to bring it on line were very simple.","https://www.amazon.com/gp/customer-reviews/R2JIXIKB7ZTXWJ/ref=cm_cr_arp_d_rvw_ttl?ie=UTF8&ASIN=B00XEW3YD6","https://www.amazon.com/gp/pdp/profile/A3KXUE14OWV0UI/ref=cm_cr_arp_d_pdp?ie=UTF8"
"Stephen W. Howard",17-Oct-2016,5,"Five Stars","Easy setup and great coverage.","https://www.amazon.com/gp/customer-reviews/REZ3BLZ6RVO69/ref=cm_cr_arp_d_rvw_ttl?ie=UTF8&ASIN=B00XEW3YD6","https://www.amazon.com/gp/pdp/profile/A16PFU19LZMBL0/ref=cm_cr_arp_d_pdp?ie=UTF8"
"Russell Karlberg",17-Oct-2016,3,"Needs improvement","Not really worth the money.  It works, but no better than a regular router.","https://www.amazon.com/gp/customer-reviews/R2OLBJHCI8QOUR/ref=cm_cr_arp_d_rvw_ttl?ie=UTF8&ASIN=B00XEW3YD6","https://www.amazon.com/gp/pdp/profile/A1RT3RVCDLAFVJ/ref=cm_cr_arp_d_pdp?ie=UTF8"
"William F Dunn",17-Oct-2016,5,"Works great","Installed faster than any prior router.  Even one unit had almost as much range as the prior ASUS RT87U router.With all 3, first time I have 100+ mbits thruout my 3500 sq ft house.I did installed with existing ethernet between the eero and the modem","https://www.amazon.com/gp/customer-reviews/R2VHU5GK4D8ONI/ref=cm_cr_arp_d_rvw_ttl?ie=UTF8&ASIN=B00XEW3YD6","https://www.amazon.com/gp/pdp/profile/A1YMP0YOJOTPTV/ref=cm_cr_arp_d_pdp?ie=UTF8"
"Robert L. Braico",16-Oct-2016,1,"Missed the mark","I so wanted these to work well but unfortunately They don't. They just can't seem to keep a decent wifi connection going. If I cycle all of them I get a good connection for a while but then it degrades so badly that it becomes useless. Moreover since you don't have access to any kind of utility to see what's going on in the app there is 0 possibility to trouble shoot. On top of that these are really pricey. Promising concept but bad execution.I'm reducing my 2 stars to one.  I thought I'd given them the benefit of the doubt and see if app updates helped.  They haven't and I get to spend the day tomorrow reverting back to my old wifi.  You can literally be standing next to one of these and not get a good wifi connection.  My Amazon echo in the kitchen is about 6 feet from one and we can't stream music.  Just an awful experience.","https://www.amazon.com/gp/customer-reviews/R35NHW1T02OWAL/ref=cm_cr_arp_d_rvw_ttl?ie=UTF8&ASIN=B00XEW3YD6","https://www.amazon.com/gp/pdp/profile/A2HJW0KJ3EYVZQ/ref=cm_cr_arp_d_pdp?ie=UTF8"
"Jason Post",16-Oct-2016,5,"Expensive product but easily and quickly solved a huge problem in my house","Expensive product but easily and quickly solved a huge problem in my house. I now have seamless high speed wifi coverage throughout my home.","https://www.amazon.com/gp/customer-reviews/R2RZDZ1RW9M4B1/ref=cm_cr_arp_d_rvw_ttl?ie=UTF8&ASIN=B00XEW3YD6","https://www.amazon.com/gp/pdp/profile/A2Q78GQMJI6RVW/ref=cm_cr_arp_d_pdp?ie=UTF8"
"Ruben Olivares",16-Oct-2016,5,"Eero in Chile","Works perfect. Easy set up, amazing range.","https://www.amazon.com/gp/customer-reviews/R32BGV94RC6UKK/ref=cm_cr_arp_d_rvw_ttl?ie=UTF8&ASIN=B00XEW3YD6","https://www.amazon.com/gp/pdp/profile/A1NX5VF0QFH8ZL/ref=cm_cr_arp_d_pdp?ie=UTF8"
"Steven Harris",16-Oct-2016,5,"A simple router for lazy people.","The Eero's is easy to set up and fixes a lot of big problems that plague the wi-fi genre.","https://www.amazon.com/gp/customer-reviews/R1VWXNL7XWOJ65/ref=cm_cr_arp_d_rvw_ttl?ie=UTF8&ASIN=B00XEW3YD6","https://www.amazon.com/gp/pdp/profile/A29XQ1CVVLCT4A/ref=cm_cr_arp_d_pdp?ie=UTF8"
"Weaver",16-Oct-2016,5,"I really love the simplicity of the eero setup","I really love the simplicity of the eero setup. You can certainly buy a router and the range extender or access points separately. Then you have to do all the configuring yourself when you get home. This isn't a huge problem really but how easy it was to set this up, It just doesn't make sense to get something else. I'm top of that, the app they deliver is so simple and I can see that the speeds I'm getting in just about every corner of my house now are top notch. Certainly recommend this to anyone looking for ease of set up I also getting great's throughput.","https://www.amazon.com/gp/customer-reviews/R2H6H94XFA3OFU/ref=cm_cr_arp_d_rvw_ttl?ie=UTF8&ASIN=B00XEW3YD6","https://www.amazon.com/gp/pdp/profile/AXU94U8D18JPU/ref=cm_cr_arp_d_pdp?ie=UTF8"
"Amazon Customer",16-Oct-2016,2,"It's a MESS, not MESH","The eero setup was super quick and easy. It eliminated the dead spots and achieved faster speeds.It was great, until they dropped the connection. Hours after the setup was complete, I noticed the internet stopped working. I didn't think anything of it and rebooted the eeros. Problem solved. So I thought...Over the next few days I've had more dropped connections than I can count. They loose connection all the time. Wifi appears to be transmitting but no internet connection. To make matters worse, my Sonos controller can never connect. I figured it was a Sonos problem, so I spent 2 hours with customer service to optimize the setup and make it work again.Hours later, the Sonos controller can't can't connect again. And, internet down! Time to reboot again. What a mess!Why can't eeros stay connected? Please don't tell me it's an ISP issue...because that's bull@#$. My previous wifi router (Asus 68w) worked flawlessly. Always connected! 100% uptime.My setup:1st eero: Cable Modem &#62; Asus 56u Router &#62; eero &#62;  Sonos boost2nd eero: Cable Modem &#62; Asus 56u Router &#62; eero &#62;  Sonos player3rd eero: eero &#62; eero","https://www.amazon.com/gp/customer-reviews/R34EF6P7QO9P8R/ref=cm_cr_arp_d_rvw_ttl?ie=UTF8&ASIN=B00XEW3YD6","https://www.amazon.com/gp/pdp/profile/A153H3Q7TOOOE1/ref=cm_cr_arp_d_pdp?ie=UTF8"
"Liz Jurica",15-Oct-2016,5,"Very happy with this product","Very happy with this product. Really improved our WiFi throughout our house. We had spots that we could barely get WiFi, and now we are getting great connectivity throughout our entire house.","https://www.amazon.com/gp/customer-reviews/R5HDFS1GLC7KU/ref=cm_cr_arp_d_rvw_ttl?ie=UTF8&ASIN=B00XEW3YD6","https://www.amazon.com/gp/pdp/profile/A1EY26IKXT97K2/ref=cm_cr_arp_d_pdp?ie=UTF8"
"Johanna C. Levenius",15-Oct-2016,5,"Outrageously easy setup which is completed in minutes","Price is the toughest choice on this system. Outrageously easy setup which is completed in minutes. No dead spots, fast streaming with Roku and Slingbox. Auto firmware updates. Would like to see added advanced settings in the future for price.","https://www.amazon.com/gp/customer-reviews/R2QFRPX9IK9TLB/ref=cm_cr_arp_d_rvw_ttl?ie=UTF8&ASIN=B00XEW3YD6","https://www.amazon.com/gp/pdp/profile/A1KHLZ69XLM0JO/ref=cm_cr_arp_d_pdp?ie=UTF8"
"Susan",14-Oct-2016,4,"Four Stars","Excellent product. Just wish it was a little cheaper.","https://www.amazon.com/gp/customer-reviews/R2AYK5IYP5PG56/ref=cm_cr_arp_d_rvw_ttl?ie=UTF8&ASIN=B00XEW3YD6","https://www.amazon.com/gp/pdp/profile/A2TNH50P503EWP/ref=cm_cr_arp_d_pdp?ie=UTF8"
"Ariel Benzakein",14-Oct-2016,5,"Easy setup, solid performance","I replaced an Amplifi HD with a 3 eero setup because the Amplifi HD only supports 30 wireless devices (I have 35 now and will be adding more for home automation) and the eero supports up to 128.  I have FiOS 500 up/500 down, so there is plenty of bandwidth to support everything.  The eero is pretty easy to set up - all plug & play; the trick is in positioning the satellite systems in optimal locations.  My house is about 3400 sq ft and I now have solid WIFI everywhere.  I found the throughput to be a lot better on the Amplfii, but the eero is pretty good too (nothing below 120 down in any corner of my house, which is certainly fast enough).","https://www.amazon.com/gp/customer-reviews/RDIO3K2RNZO6H/ref=cm_cr_arp_d_rvw_ttl?ie=UTF8&ASIN=B00XEW3YD6","https://www.amazon.com/gp/pdp/profile/A1NF7WJJ5U0TGZ/ref=cm_cr_arp_d_pdp?ie=UTF8"
"DanG",13-Oct-2016,5,"Fantastic and PHENOMENAL Customer Service/Support","I concur with many of the others that this product is a game changer. Solid speeds throughout my entire home and outside areas. If you can get past the price tag it is well worth the investment. Customer service/ Support is STELLAR! Not a deal-breaker but I would like to see MAC filtering added as a feature.","https://www.amazon.com/gp/customer-reviews/R1B0BMAS6HDKYE/ref=cm_cr_arp_d_rvw_ttl?ie=UTF8&ASIN=B00XEW3YD6","https://www.amazon.com/gp/pdp/profile/A9AHM9SVXQLQJ/ref=cm_cr_arp_d_pdp?ie=UTF8"
"parentreview",13-Oct-2016,5,"Five Stars","Easy setup.  Fast speeds.","https://www.amazon.com/gp/customer-reviews/R2OLFAQ86NG16Y/ref=cm_cr_arp_d_rvw_ttl?ie=UTF8&ASIN=B00XEW3YD6","https://www.amazon.com/gp/pdp/profile/AB5F33P7FLIXD/ref=cm_cr_arp_d_pdp?ie=UTF8"
"Sasha Mukerjee",13-Oct-2016,5,"The experience improved instantly and this was one of the best investments I've made for our home internet","I was skeptical about performance given the trouble I had had previously with routers and extenders. The eero system was extremely simple to install and worked instantly. The experience improved instantly and this was one of the best investments I've made for our home internet. If you've got an older home that's 3 stories like we do this system will work for you....","https://www.amazon.com/gp/customer-reviews/R3U6EAJH64ZY4I/ref=cm_cr_arp_d_rvw_ttl?ie=UTF8&ASIN=B00XEW3YD6","https://www.amazon.com/gp/pdp/profile/AVU0CNRCM8OQB/ref=cm_cr_arp_d_pdp?ie=UTF8"
"Rafael R",13-Oct-2016,5,"Great product. Very easy to set up","Great product.  Very easy to set up.  I bought the three unit pack and have great wi-fi access through my 3200 sq. ft. home including the porch and back patio.  I had issues in my previous home and had to use multiple wi-fi systems and multiple SSIDs to get spotty coverage.  One of the systems was an Airport Time Capsule with an additional Airport Express set up as a bridge.  The eero is providing superior coverage and I have no issues with streaming video programs.  It's a great investment--set it up and forget it.  Very easy to provide guest access.  You can text them an invitation message provided by the eero app with the password.","https://www.amazon.com/gp/customer-reviews/R1N230H0N0Z2GM/ref=cm_cr_arp_d_rvw_ttl?ie=UTF8&ASIN=B00XEW3YD6","https://www.amazon.com/gp/pdp/profile/A1KCGXWDJHKFEF/ref=cm_cr_arp_d_pdp?ie=UTF8"
"Michael",13-Oct-2016,5,"eero wifi is the greatest wifi system for the home ever!","eero is simply awesome! We had spotty wifi in our house for years. I am a Sr Systems Engineer and was on the fence with buying a large enterprise system to get better coverage through our 4000 sq ft, 3 level home. I have used various APs in the past around the house and always had no luck getting 100% coverage. I found eero and decided to give it a try. It's the best money ever spent on wifi APs ever. I have signal in places I couldn't get signal before and even in my garage now where I never used to get signal. I'd buy it again but hopefully I won't have to for a while!","https://www.amazon.com/gp/customer-reviews/R337Z7BDLKGAAK/ref=cm_cr_arp_d_rvw_ttl?ie=UTF8&ASIN=B00XEW3YD6","https://www.amazon.com/gp/pdp/profile/A31PKL9T4WTWS3/ref=cm_cr_arp_d_pdp?ie=UTF8"
"Amazon Customer",13-Oct-2016,5,"These are great for any home","Cannot get enough!These are great for any home.","https://www.amazon.com/gp/customer-reviews/R33FPIWIN1JWOC/ref=cm_cr_arp_d_rvw_ttl?ie=UTF8&ASIN=B00XEW3YD6","https://www.amazon.com/gp/pdp/profile/A27ZZLMNNYSVC3/ref=cm_cr_arp_d_pdp?ie=UTF8"
"Aaron Cohen",12-Oct-2016,5,"This is a great product and I highly recommend it to people who ...","This is a great product and I highly recommend it to people who want control of their own wifi.  It was super simple to set up and took me an hour to get all three of my devices working and fairly well optimized. I did play with placement.  I had trouble bridging my router or even knowing that I had to do that, but a great customer service call with Matt walked me through it and we did speedtests before and after.  Company is going to do very well.One issue:  I live in a 4 floor 6000 square foot house and it's not clear to me that 3 Eeros will be enough.  However, I've only spent 500 bucks so far and every network optimization quote I got was minimum 2k in service and new hardware (the fallacy of commercial grade routers).  This is a DIY product for people who aren't amazing with network technologies.","https://www.amazon.com/gp/customer-reviews/R1JK7N8KENIQWN/ref=cm_cr_arp_d_rvw_ttl?ie=UTF8&ASIN=B00XEW3YD6","https://www.amazon.com/gp/pdp/profile/A2OIAXSS12FXM5/ref=cm_cr_arp_d_pdp?ie=UTF8"
"AR30MY",12-Oct-2016,5,"Resolved a whole bunch of issues. Units are designed ...","Resolved a whole bunch of issues.  Units are designed to be linked wirelessly.  I needed to call for info on wired hookup, no info in manual.  For me it was well worth the rathe high cost.","https://www.amazon.com/gp/customer-reviews/R1CGZ89M8ZDWUI/ref=cm_cr_arp_d_rvw_ttl?ie=UTF8&ASIN=B00XEW3YD6","https://www.amazon.com/gp/pdp/profile/A1SSCXCXONFULZ/ref=cm_cr_arp_d_pdp?ie=UTF8"
"WillGo",11-Oct-2016,4,"Works well.","Works well.","https://www.amazon.com/gp/customer-reviews/REOZKVSARLR7J/ref=cm_cr_arp_d_rvw_ttl?ie=UTF8&ASIN=B00XEW3YD6","https://www.amazon.com/gp/pdp/profile/A1CAP6RK41EVNI/ref=cm_cr_arp_d_pdp?ie=UTF8"
"JPN",11-Oct-2016,5,"Success","The eero has been amazing. It's brought speedy wifi to our 3-story old Victorian. Our old home has chicken-wire in the walls, which tends to block any kind of comprehensive coverage - before we'd needed two different wifi routers with two different networks, and it was still spotty in the upper and lower corners of the home. With eero, we just plugged it in and were ready to go - and we immediately had seamless coverage everywhere. We used three devices but probably only actually even needed two. Plus, they're very sleekly designed, and don't overheat.  Only downside is the sky high sticker price.","https://www.amazon.com/gp/customer-reviews/R3NSRJ51TLCX5W/ref=cm_cr_arp_d_rvw_ttl?ie=UTF8&ASIN=B00XEW3YD6","https://www.amazon.com/gp/pdp/profile/AIYN5QX3K65XB/ref=cm_cr_arp_d_pdp?ie=UTF8"
"Karl M. Weiler",10-Oct-2016,5,"Works well","Works well easy to install","https://www.amazon.com/gp/customer-reviews/R3ICQE9HIRNFJ1/ref=cm_cr_arp_d_rvw_ttl?ie=UTF8&ASIN=B00XEW3YD6","https://www.amazon.com/gp/pdp/profile/AERDPGOKN0YFB/ref=cm_cr_arp_d_pdp?ie=UTF8"
"Jean Avrick",10-Oct-2016,5,"Five Stars","It works !!","https://www.amazon.com/gp/customer-reviews/R2DOR3AU5GI38D/ref=cm_cr_arp_d_rvw_ttl?ie=UTF8&ASIN=B00XEW3YD6","https://www.amazon.com/gp/pdp/profile/A2V39NWFY0Y7ZU/ref=cm_cr_arp_d_pdp?ie=UTF8"
"Terry L Franklin",09-Oct-2016,5,"Truly that easy.","This really is as easy as it appears and so far works so much better than other options I've tried.","https://www.amazon.com/gp/customer-reviews/R1Z44BW1KQV86I/ref=cm_cr_arp_d_rvw_ttl?ie=UTF8&ASIN=B00XEW3YD6","https://www.amazon.com/gp/pdp/profile/ATVUYOXAIUGY7/ref=cm_cr_arp_d_pdp?ie=UTF8"
"JJ &amp; AW",08-Oct-2016,5,"Tech'in at home no more","Sometimes a briefer review is more helpful and this one is just that. eero tech support is 5 star, I contacted them for pre-sale and then after purchase; no issues at all. Amazing experience and an amazing product. The after sale tech contact was just thanking eero for engineering such a fantastic product. If you can setup an iPhone you can do eero. Download an app, plugin, enjoy seamless wifi!Evaluating all the current and new entities into the home mesh network space I easily picked the eero system over others. I do tech all day at work and when I'm home I want to use services and products that enhance my life as transparently as possible. All Mac, all iPhone and an all eero network...it like heaven. Simple and it works everytime I need it to. The eero 3-pack replaced 3 routers in my older home with 13&#34;thick brick walls. Now rather than 5 SSID's and passwords we have 1 continuous zone for the family and 1 super secure guest network.","https://www.amazon.com/gp/customer-reviews/R3C36LVPKYVHXA/ref=cm_cr_arp_d_rvw_ttl?ie=UTF8&ASIN=B00XEW3YD6","https://www.amazon.com/gp/pdp/profile/A32G0J5Z2CCRB3/ref=cm_cr_arp_d_pdp?ie=UTF8"
"TimbosNintendo",08-Oct-2016,5,"Perfect solution, easybto set up and manage","This solution to our Wi-Fi problem was perfect. I can now control my wi-fi system completely and installtion only took about 30 minutes. I would recommend this product to anyone who is having Wi-Fi issues in their home.","https://www.amazon.com/gp/customer-reviews/R3RGM42VHKLCJR/ref=cm_cr_arp_d_rvw_ttl?ie=UTF8&ASIN=B00XEW3YD6","https://www.amazon.com/gp/pdp/profile/A12BAJ2MSSY996/ref=cm_cr_arp_d_pdp?ie=UTF8"
"gmkwan",07-Oct-2016,4,"Very good! Awesome speed and easy to set up","Very good ! Awesome speed and easy to set up. Regret not to buy it earlier.","https://www.amazon.com/gp/customer-reviews/R1GU6K4W6939FK/ref=cm_cr_arp_d_rvw_ttl?ie=UTF8&ASIN=B00XEW3YD6","https://www.amazon.com/gp/pdp/profile/A2Q3L5ZW2TR8FD/ref=cm_cr_arp_d_pdp?ie=UTF8"
"Dwayne F.",07-Oct-2016,5,"Five Stars","Easy to set up. Easy to monitor. The best wifi we ever had in our home.","https://www.amazon.com/gp/customer-reviews/R2FQBOIW3EIZDD/ref=cm_cr_arp_d_rvw_ttl?ie=UTF8&ASIN=B00XEW3YD6","https://www.amazon.com/gp/pdp/profile/A1WHOPHPYD1WXT/ref=cm_cr_arp_d_pdp?ie=UTF8"
"Seewolf",07-Oct-2016,5,"Fantastic system","I spent a lot of time looking at different mesh systems and settled on the eero. I couldn't be happier.I previously had multiple wifi networks in my home to provide full coverage over the three floors. I spent quite a bit of time looking at systems from Ubiquiti and Luma. I purchased an Ubiquiti system that was open box and one of the three access points was giving me trouble so I ended up returning it. The Luma system I had on order was promised for months and never arrived. Thank you to Amazon for helping me get that straightened out. Luckily for me, the delay gave me a chance to read reviews of bot the eero and Luma system and I decided to pay the extra money for the eero system.I'm lucky that my home has an extensive wired network in place so I was able to install all three pieces with wired connections - one on each level of the home. I now have fast and strong connections in every room of my home with no dead spots and no need to change from one network to another. The ability to see every device (wired and wireless) in the house is great. My previous main wireless router was the SkyDog system and I got used to having easy access to turn on and off individual devices and assign them to groups. This is great when the kids are spending too much time online and need a gentle reminder that it is time to put the electronics away (although it isn't really that gentle when there access is suddenly shut off!).I've been very happy with the speed of the wifi. My home currently has 80Mbps broadband. My previous system never came close to this speed but I now routinely see the full 80Mbps through speedtest.net or fast.com (when the wifi traffic on the network is low).A couple of things I would like to see:- The ability to hide the SSID. There is currently no way to turn off the transmission of the network name. I usually keep this hidden, in a dense neighborhood I see this as one extra layer of security.- A filter for web content. This is one thing I loved about the SkyDog system (RIP) and one of the big reasons I initially had a Luma system on order but am so happy with the rest of the system the I'm willing to deal with that. By the way, as of the writing of this review I have a friend who did get the Luma system and has been disappointed so far since (according to them) the filter function is not yet active.Overall, I would recommend this system to anyone who needs a robust mesh network to cover a larger home or small office.","https://www.amazon.com/gp/customer-reviews/R1XC84RBWSF1TM/ref=cm_cr_arp_d_rvw_ttl?ie=UTF8&ASIN=B00XEW3YD6","https://www.amazon.com/gp/pdp/profile/A3BOIHIV0BE9AF/ref=cm_cr_arp_d_pdp?ie=UTF8"
"LizaG68",07-Oct-2016,5,"Best thing since sliced bread!","If you are, like we were, tired of spending $200 here and there on &#34;more powerful&#34; wireless networks, adaptors, extenders, etc...that take hours to set up (and are very confusing) only to continually have dead spots in your home, or weak signals, buffering, and drops...you will LOVE eero!  In less than 30 minutes, we had our 3 unit eero system up and running with the fastest speed and strongest signals we have ever had in our two story (2,500+ square feet) home.  No dead spots, buffering issues are gone, no more issues where the kids are complaining because the wifi dropped a signal.  Honestly, we don't really think about our wifi any longer - except for when I happen to see the cute little white square, which, by the way is another plus.  Our last wireless adaptor had so many antennas and continuously blinking lights, our living room was starting to look like the Nassau space center!  The only con is the price - which is why we resisted buying it for a while.  But once you get over that, welcome to your new no-wifi-issue home!","https://www.amazon.com/gp/customer-reviews/R13PQ2C10NGHMR/ref=cm_cr_arp_d_rvw_ttl?ie=UTF8&ASIN=B00XEW3YD6","https://www.amazon.com/gp/pdp/profile/ASYID9XFC8SBW/ref=cm_cr_arp_d_pdp?ie=UTF8"
"Jim Murphy",06-Oct-2016,5,"Great product!","Simple, elegant, extremely easy to step up.  Very fast and reliable after more than four months.","https://www.amazon.com/gp/customer-reviews/R3441EMQWPWXKF/ref=cm_cr_arp_d_rvw_ttl?ie=UTF8&ASIN=B00XEW3YD6","https://www.amazon.com/gp/pdp/profile/A29W8AWF077LV7/ref=cm_cr_arp_d_pdp?ie=UTF8"
"KEO K ZAIGER",06-Oct-2016,5,"Easy Setup, Outstanding Performance","The installation was very easy with an iPhone.  The eero app walks you through the process and helps you place each router.  The main router recognized the cable modem right away and there was no need to resort to a laptop.The performance in an old house with multiple level and a lot of plaster has been outstanding.  We get 90-100 Mbps download speeds from the attic to the basement (with two floors in between).We live in our own fourplex and provide wifi to our tenants, so ease of setup and maintenance without having to enter rental units was a priority.  Eero is well worth the extra cost.","https://www.amazon.com/gp/customer-reviews/R15JKOM5ONTCX2/ref=cm_cr_arp_d_rvw_ttl?ie=UTF8&ASIN=B00XEW3YD6","https://www.amazon.com/gp/pdp/profile/A32UVTOUOOP0BF/ref=cm_cr_arp_d_pdp?ie=UTF8"
"Lee Marrette",06-Oct-2016,5,"Highly recommended.","I recently bought a highly rated router and still had dead spots in the house.  Eero home wifi has eliminated all dead spots.  It was also the easiest installation of any of the routers I've tried.  Highly recommended.","https://www.amazon.com/gp/customer-reviews/R83VH4GVYH09P/ref=cm_cr_arp_d_rvw_ttl?ie=UTF8&ASIN=B00XEW3YD6","https://www.amazon.com/gp/pdp/profile/AXXFQD5L04W28/ref=cm_cr_arp_d_pdp?ie=UTF8"
"WaffleHouseFan",06-Oct-2016,5,"Delighted","Super easy to set up and works fantastic, and their customer support was super helpful in tuning the system.  Absolutely delighted!","https://www.amazon.com/gp/customer-reviews/R3B7DATRXLW285/ref=cm_cr_arp_d_rvw_ttl?ie=UTF8&ASIN=B00XEW3YD6","https://www.amazon.com/gp/pdp/profile/A1V922MFZ7HW69/ref=cm_cr_arp_d_pdp?ie=UTF8"
"Hodge Junior",06-Oct-2016,5,"Great Performance","It was a breeze to install and has worked flawlessly ever since.  My &#34;problem corner&#34; has disappeared.","https://www.amazon.com/gp/customer-reviews/R2IAMU0IB4H7QA/ref=cm_cr_arp_d_rvw_ttl?ie=UTF8&ASIN=B00XEW3YD6","https://www.amazon.com/gp/pdp/profile/AJYNBR6TJI55U/ref=cm_cr_arp_d_pdp?ie=UTF8"
