Username,Date,Star Rating,Title,Review Comment,Review Link,User Profile Link
"Eileen Parry",30-Jan-2017,5,"Cutting the cord","One of the easiet plug aand play devices I have ever installed. Although the system is a little pricey, we now longer have any dead / slow zones in the house at least we havent discovered any. Also we will regain our investment in a few short months once we cut the cable cord.Easy to follow directions, the system was completely installed in under 30 minutes. After installation I gathered every one in the house and had them log onto wifi with all the devices ; 4 cell phones, three tablets and one smart t.v, not one slow down any device.I appreciate that you can check the system anytime you want and the system checks itself and reports it to your device.","https://www.amazon.com/gp/customer-reviews/R2HAAXZDAWA72M/ref=cm_cr_arp_d_rvw_ttl?ie=UTF8&ASIN=B00XEW3YD6","https://www.amazon.com/gp/pdp/profile/A10P5ZVH25JVTZ/ref=cm_cr_arp_d_pdp?ie=UTF8"
"SB",30-Jan-2017,5,"Pricey but worth the investment.","This is a pricey system but worth the investment.  I replaced my ancient Apple AirPort, and had a fast mesh network running throughout the home 15 minutes after unboxing.  Speed is at the stated Comcast rate in every room.  Straightforward instructions through the mobile app.  No more Netflix/HBO queuing.  Well done Eero!","https://www.amazon.com/gp/customer-reviews/R2PXGEPCDOLHAP/ref=cm_cr_arp_d_rvw_ttl?ie=UTF8&ASIN=B00XEW3YD6","https://www.amazon.com/gp/pdp/profile/AWT5KPIAE6BFS/ref=cm_cr_arp_d_pdp?ie=UTF8"
"Byron Antillon",29-Jan-2017,2,"I was getting better speeds on my older Apple airport extreme","I placed one of the three eero's in my office and the speeds there are slow. I pay for a 300Mbps x 20Mbps connection and I'm seeing 42Mbps in my office (~10' away from the eero which is directly connected to my cable modem).  Perhaps I'm too close to the eero but I can't force my PC to connect to a further eero. In any case for the price I paid for this device I should see much faster speeds that 42Mbps. I was getting better speeds on my older Apple airport extreme. That said the interface on the app and the setup were quite simple, I really like the family profiles and based on that I rate this product a 2. But seriously $500 hardware to get such slow speeds is ridiculous.  Performance on the other two devices fluctuates greatly depending a several variables, so overall I'm not happy. I would probably try similar technology offered by several other competitors (Google On-Hub, Linksys Velop or Neatgear's Orbi) all in similar price points and Linksys does offer their tri-band technology which sounds promising! Do your research before you commit to eero.  They may have been first to market, but the competition is steep and getting better.","https://www.amazon.com/gp/customer-reviews/R1VWRT1X7ZXI2Y/ref=cm_cr_arp_d_rvw_ttl?ie=UTF8&ASIN=B00XEW3YD6","https://www.amazon.com/gp/pdp/profile/A1LV5BBLC9VSNY/ref=cm_cr_arp_d_pdp?ie=UTF8"
"F. Anderson",29-Jan-2017,5,"Pricy, but easy to install and works great","I had so many frustrations with my WiFi reception at home.  Gradually, wireless devices were filling every room of my home and my WiFi signal was weak or absent in many parts of the house.  When I installed 2 nest thermostats I discovered that the signal was too weak in the bedroom.  The ECCO system was expensive, but was so easy to set up and the WiFi is now strong in every corner of my 3,500 sq-ft home.","https://www.amazon.com/gp/customer-reviews/R2MKM1EYVQ4L6I/ref=cm_cr_arp_d_rvw_ttl?ie=UTF8&ASIN=B00XEW3YD6","https://www.amazon.com/gp/pdp/profile/A2RI6P6E6F509U/ref=cm_cr_arp_d_pdp?ie=UTF8"
"matthew v voigt",29-Jan-2017,5,"If you're smart enough to pick eero...","If you're smart enough to pick eero to fix a wifi coverage problem than you get what you deserve, a solution.The brains required to pick eero are also adequate to install and use eero.Wow, using technology to help and not frustrate more... what a great concept and product!Keep up the good work eero and i'll find a differerent problem to fix.Thank you!","https://www.amazon.com/gp/customer-reviews/R2KY5OKYFKB57A/ref=cm_cr_arp_d_rvw_ttl?ie=UTF8&ASIN=B00XEW3YD6","https://www.amazon.com/gp/pdp/profile/A2JYFTEF9H90S0/ref=cm_cr_arp_d_pdp?ie=UTF8"
"Navym",29-Jan-2017,5,"Five Stars","Works perfect!!!","https://www.amazon.com/gp/customer-reviews/R5V8HDLRZ8ZN6/ref=cm_cr_arp_d_rvw_ttl?ie=UTF8&ASIN=B00XEW3YD6","https://www.amazon.com/gp/pdp/profile/A1PGN3MDGP5S0T/ref=cm_cr_arp_d_pdp?ie=UTF8"
"A. Lynley",29-Jan-2017,5,"Dead zones no more","I have a three story townhome which had signal problems regardless of where I moved the router. I enjoy streaming music and video and the eero took care of the dead spots in the house. I bought the three transponder set and LOVE it. Easy set up and away you go.","https://www.amazon.com/gp/customer-reviews/R344RZJ3DYZZ3J/ref=cm_cr_arp_d_rvw_ttl?ie=UTF8&ASIN=B00XEW3YD6","https://www.amazon.com/gp/pdp/profile/A30UW1WJ9MV40E/ref=cm_cr_arp_d_pdp?ie=UTF8"
"Jewel B",29-Jan-2017,5,"I bought this system to use our smart TV streaming features","I bought this system to use our smart TV streaming features.  It's important to place the eero within 40 feet of each other to get wifi speeds to stream movies etc.  Once we placed them correctly it works great.  Am glad I purchased and would recommend to others who have issues with streaming or gaming.","https://www.amazon.com/gp/customer-reviews/R2KMC8PBQWRQ1/ref=cm_cr_arp_d_rvw_ttl?ie=UTF8&ASIN=B00XEW3YD6","https://www.amazon.com/gp/pdp/profile/A858F5IW5M0GM/ref=cm_cr_arp_d_pdp?ie=UTF8"
"Amazon Customer",29-Jan-2017,5,"excellent Wi-Fi signal for the gamer","Game changer in my house. Because I have a house built in early 1920's all plaster walls with lattes, very difficult time getting a decent Wi-Fi connection in son's second floor bedroom. Eero changed that. 3 units installed,  one next to incoming modem, in hallway and in his room. No buffering, excellent Wi-Fi signal for the gamer, not being yelled at by son that the Wi-Fi signal is for crap, peace and tranquility in house. Added bonus.. I can shutdown his connections and my request to study for finals SOLVED.","https://www.amazon.com/gp/customer-reviews/RX4CC58O5FWPT/ref=cm_cr_arp_d_rvw_ttl?ie=UTF8&ASIN=B00XEW3YD6","https://www.amazon.com/gp/pdp/profile/A18RUOH1V2LOZR/ref=cm_cr_arp_d_pdp?ie=UTF8"
"Kurt Howard",29-Jan-2017,5,"Do yourself a favor!","Is it a bit pricey? Yes. Do you want to simplify your Wi-Fi experience  with no more dropped signals., waiting for buffer, other frustrating interruptions in service due to spotty  wi-Fi networking?  Place an order for one of these bad boys today and all your problems are solved. I love spending  Time in my office in around my home again. Especially love no more wires wires wires. I had unboxed and at this  Eero set up in 15 minutes. Very simple even for a novice . I have many devices that connect to my eero, I'll mail running at blazing speed never seen before. I have three laptops,  DirecTV, Amazon fire stick, two iPhones,  and a few other devices that connected with ease. This is the first time I have felt compelled to write a customer review likely because it's the first time I have ever been blown away by a product. Do yourself a favor and simplify your Wi-Fi environment.","https://www.amazon.com/gp/customer-reviews/R13PD674FCRWEB/ref=cm_cr_arp_d_rvw_ttl?ie=UTF8&ASIN=B00XEW3YD6","https://www.amazon.com/gp/pdp/profile/A1N0R2NZM8CRTX/ref=cm_cr_arp_d_pdp?ie=UTF8"
"Joydeep Hazra",28-Jan-2017,5,"This was an excellent buy, solved all my domestic wifi traffic jams","This was an excellent buy, solved all my domestic wifi traffic jams. Very easy to install with logical step by step instructions in one go. Connected it to my home cable router & no additional modifications. It's a simple add on to existing home wifi option. Pricey compared to other options but worth it as its operational 24/7.","https://www.amazon.com/gp/customer-reviews/RMQ095UEA5W8B/ref=cm_cr_arp_d_rvw_ttl?ie=UTF8&ASIN=B00XEW3YD6","https://www.amazon.com/gp/pdp/profile/AC7E4BSVH1KMV/ref=cm_cr_arp_d_pdp?ie=UTF8"
"Maui",28-Jan-2017,2,"FiOS/Sonos/AppleTV incompatibility  sending eero back","Lengthy note follows so I have divided it into 3 sections if you want to skip ahead: (1) the problems I had (1 star); (2) experience with eero Customer Support (4 stars); and (3) implications for other potential buyersThe ProblemsI dont think I have anything unusually complicated but it is also not a simple set-up.  I have Verizon FiOS, which means we have a single unit for the modem/router.  This also, per the eero website, creates a distinctive wireless environment where the FiOS wireless network shouldnt be turned off once eero is up and running.  Connected to the wifi network is a collection of devices  computers, cell phones, tablets; some smart thermostats (Nest and Ecobee) and, unfortunately for eero, two Sonos AMP boxes to play music in a couple of our rooms and an AppleTV device.I found the installation process initially stressful but ultimately straightforward and simple.  The initial stress was because after reading about the potential challenges with FiOS I was worried that I wouldnt be able to figure out how to make it work.  Eero recommended putting the eero in Bridge mode and this differs from the step by step instructions they have available so I was concerned I would lose my way in the install.  However, it is very easy, which is what eero told me it would be.  It took about 15 minutes to get the three eero devices connected and functioning, and the mobile eero app was very easy to use.  After I got the eeros up and running connecting the other devices to the eero network was also straightforward  nothing different than connecting to any other wifi network.  All the computers, iPads, thermostats etc. all found the network and connected without any apparent problems.  Importantly, the eero signal was strong throughout the house, which was the major issue I was trying to solve.However, it was a different story with Sonos and AppleTV. Mysteriously, one of the Sonos boxes would drop out of the eero network after initially being found, and one of the Sonos boxes worked perfectly.  If I rebooted the faulty Sonos box, right after the reset I would see it on the eero network but as soon as I tried to play music, it would drop off.  The AppleTV was similarly mysteriously faulty. I like to use the AppleTV to play music on our home sound system and the music is located on my iPhone.  Prior to eero, this was easy to do  AppleTV recognized my iPhone and the music (and other content) on the phone and would play it.  However, with eero, AppleTV didnt find the phone.  Oddly, I can use my iPhone in Airplay mode to still play music via AppleTV.  In other words I could push music from my iPhone to AppleTV but I couldnt pull music using AppleTV from the iPhone.  Figure that one out!Customer Service ExperienceThis experience was positive, despite neither of the problems being solved.  I used email exchanges to communicate with the eero folks  I wanted to make sure they had time to figure out my problem and suggest an appropriate fix and I wanted to be able to try the fix on my own time.  Eero would respond in hours to my emails and their responses were friendly, easy to read and understand and they were not condescending to me, given my lack of technical aptitude.  Alos, every email from eero includes the phone number and hours of operation in case I wanted to call and speak with someone live  how many times have we been to help websites and been unable to find a phone number!  I want to thank Raoul, Isaac, and Hayden for helping try to solve the problems.  However, nothing worked so I am going to pull out the eero network and send it back.Implications for othersReflecting on this situation, I think there are some generalizations to think about if you are considering purchasing eero.  The first is that everyones wifi situation is going to be unique and I am sure others are successfully using Sonos and AppleTV with eero. So my problems are mine, and may not be yours.  Second, eero wont work in all instances.  There is obviously something going on between the eero network and some systems that reside on it.  This is important to think about because I would have thought the eero network was dumb  it would capture a wifi signal from a device and pass it on its way without any modification.  However, eero appears to be doing something to the information it picks up  it is trying to be smart - and this is where problems will arise.  As I dug deeper into the help section and the eero community blogs I found many instances where eero was interacting in odd ways with devices on the network.  Often the problem would be solved.  There were a number of instances where people had posted that after an eero software update what had been working stopped working.  This needs to be considered as well  because of the way eero has designed its system, it might make a change in the future (or someone like Sonos or Apple might make a change) and your system will go down again.  This is ultimately why I told eero to stop working on my problem  I decided that even if they fixed it (which is a big if) I didnt want to run the risk that I would have to go through this all over again the next time they released an update.My brother is an engineer at Cisco (how is that for supposedly having an unfair advantage!) and he recommended I try an access point since I have Ethernet cable throughout my house. He recommended: TP-Link TL-WA901ND Wireless N450 3TER Access Point, 2.4Ghz 450Mbps, 802.11b/g/n, AP/Client/Bridge/Repeater, 3x 5dBi, Passive POE.  I am going to give these a try but reading the product name makes me nervous  I have no idea what any of this means!","https://www.amazon.com/gp/customer-reviews/R1CCQCWKC3H3WG/ref=cm_cr_arp_d_rvw_ttl?ie=UTF8&ASIN=B00XEW3YD6","https://www.amazon.com/gp/pdp/profile/A1FW7CHMD950HD/ref=cm_cr_arp_d_pdp?ie=UTF8"
"Amazon Customer",28-Jan-2017,5,"Five Stars","cleared up our dead zones  - works awesome","https://www.amazon.com/gp/customer-reviews/R34LW68U5HNLO6/ref=cm_cr_arp_d_rvw_ttl?ie=UTF8&ASIN=B00XEW3YD6","https://www.amazon.com/gp/pdp/profile/A252LCTG10VRM0/ref=cm_cr_arp_d_pdp?ie=UTF8"
"Joyce M. Goodwin",28-Jan-2017,5,"Five Stars","It simply works, right out of the box.  3300 sq ft house and now full speed wifi everywhere.","https://www.amazon.com/gp/customer-reviews/R3B8Q22B81VBCB/ref=cm_cr_arp_d_rvw_ttl?ie=UTF8&ASIN=B00XEW3YD6","https://www.amazon.com/gp/pdp/profile/AWJRXSZAB893O/ref=cm_cr_arp_d_pdp?ie=UTF8"
"Scott M. Barb",28-Jan-2017,5,"Got this system due to terrible performance from a comcast router/modem combo","Got this system due to terrible performance from a comcast router/modem combo. Given my house is a long one story house (slightly over 2k sq ft), a one router system just did not work at all. I have multiple nest cameras and smart home devices that require decent wifi coverage to work adequately. The cameras kept going off the wifi and could not keep a decent connection and I had no connection in the back of the house. My internet speed tested out around an avg of 40Mb/s download speed prior to installing the eero system. It was extremely easy to set up after getting comcast to place my modem in &#34;bridge mode&#34; and shut off the router component of the comcast box. Since installing the eero my speeds are regularly 4x the previous speed (averaging over 160Mb/s) and the cameras have yet to lose connection 3 weeks after installing. This system is awesome and worth the price!!","https://www.amazon.com/gp/customer-reviews/RGP60DUHE2AI8/ref=cm_cr_arp_d_rvw_ttl?ie=UTF8&ASIN=B00XEW3YD6","https://www.amazon.com/gp/pdp/profile/A1UHYIZU8XOISF/ref=cm_cr_arp_d_pdp?ie=UTF8"
"Annette Trahan",28-Jan-2017,5,"Amazing product!!!!!","Amazing product!!!!!! Did everything it said it would do when nothing else I tried worked.","https://www.amazon.com/gp/customer-reviews/R27DMSLEM73N6S/ref=cm_cr_arp_d_rvw_ttl?ie=UTF8&ASIN=B00XEW3YD6","https://www.amazon.com/gp/pdp/profile/AUUVLAMW8FUAT/ref=cm_cr_arp_d_pdp?ie=UTF8"
"Richard Ward",27-Jan-2017,5,"Worth the expense!","Works great! Covers our 2100 sq. ft. home and both floors + outside with consistent 115 mb download speed.  Not as easy to install as advertised but tech support made it all happen! Love the the small size & sleek look of the units! Went without power for 17 hours and all 3 units started automatically!  Well worth the expense.","https://www.amazon.com/gp/customer-reviews/RYRHGNXUQADLP/ref=cm_cr_arp_d_rvw_ttl?ie=UTF8&ASIN=B00XEW3YD6","https://www.amazon.com/gp/pdp/profile/A31G2PFZ6CRCCN/ref=cm_cr_arp_d_pdp?ie=UTF8"
"Glenn G",27-Jan-2017,5,"Very cool.","It just works! Great speed and coverage around the house.","https://www.amazon.com/gp/customer-reviews/RCRUV1KALX1PQ/ref=cm_cr_arp_d_rvw_ttl?ie=UTF8&ASIN=B00XEW3YD6","https://www.amazon.com/gp/pdp/profile/A1T14I7NG4K8SI/ref=cm_cr_arp_d_pdp?ie=UTF8"
"Andres F. Vasquez",27-Jan-2017,5,"I love it!","I love it!!! I moved and was hating my internet connection at the new place until I got the eero. Now it works flawlessly.","https://www.amazon.com/gp/customer-reviews/R334SBJQJEXAUO/ref=cm_cr_arp_d_rvw_ttl?ie=UTF8&ASIN=B00XEW3YD6","https://www.amazon.com/gp/pdp/profile/A3VRDC2GLC6YFN/ref=cm_cr_arp_d_pdp?ie=UTF8"
"David Arland",27-Jan-2017,5,"Works as Advertised","Works precisely as advertised.  Very happy with my Eero system.","https://www.amazon.com/gp/customer-reviews/R2JTNQALA4HWP8/ref=cm_cr_arp_d_rvw_ttl?ie=UTF8&ASIN=B00XEW3YD6","https://www.amazon.com/gp/pdp/profile/ANNU0VLLC07LI/ref=cm_cr_arp_d_pdp?ie=UTF8"
"Wade S. Gyure",27-Jan-2017,5,"Great Jeourb!","Works great, very &#34;Joe end-user&#34; friendly, and tech support experience was very positive!","https://www.amazon.com/gp/customer-reviews/RUJ9JPWCFA6JM/ref=cm_cr_arp_d_rvw_ttl?ie=UTF8&ASIN=B00XEW3YD6","https://www.amazon.com/gp/pdp/profile/A3SY2L4S5J0Q1T/ref=cm_cr_arp_d_pdp?ie=UTF8"
"Amazon Customer",27-Jan-2017,5,"Eero 3-pack (really only needed 2)","It was super easy to set up. I went from getting random top speeds of 40-75 down 15-25 up, to consistently 93+ up and 30-35 up throughout the house. It's a little bit pricey, but if it keeps running like this, it'll be well worth it.","https://www.amazon.com/gp/customer-reviews/R13H77CY3HYGBE/ref=cm_cr_arp_d_rvw_ttl?ie=UTF8&ASIN=B00XEW3YD6","https://www.amazon.com/gp/pdp/profile/A3T2ANS4S3MO9U/ref=cm_cr_arp_d_pdp?ie=UTF8"
"Troy W.",26-Jan-2017,5,"Premium product (and worth it)","Beautifully simple and effective. I'll admit the price tag gave me pause initially, but I was desperate for a solution to inconsistent WiFi throughout my home and constantly buffering Netflix and Hulu. We don't have cable, so streaming quality is important to us. The system came highly recommended by a friend who had similar issues, so I gave it a try. I had tried various routers and range extenders (wired and wireless) in the past, none of which seemed to work as advertised.First, and most importantly, the system works. It created a single, continuous network throughout my home. I don't have to switch networks when I'm on the patio or upstairs and my online and streaming experience is now what I expect it to be. We have phones, tablets, computers, printers, Sonos, Roku, etc. all connected to a single network and it works awesome.The packaging was clean and elegant. The setup could not have been more simple. The iPhone app is incredible. It allows me to monitor the network, see which devices are connected, test download and upload speeds, turn on/off guest access, and more.After several weeks, one of the units wasn't connecting to the network, so I called their support number. It was late on a Sunday evening and I was connected with a polite, English-speaking representative. He tried a few things and in a matter of minutes decided to express ship a new replacement unit instead of keeping me on the line. It was easily one of the best call center experiences I've had.Absolutely no buyer's remorse here. I'm a fan!","https://www.amazon.com/gp/customer-reviews/R3HJSF35I8AMW8/ref=cm_cr_arp_d_rvw_ttl?ie=UTF8&ASIN=B00XEW3YD6","https://www.amazon.com/gp/pdp/profile/A1NP1HNMNS8KCA/ref=cm_cr_arp_d_pdp?ie=UTF8"
"John R. Knapp",26-Jan-2017,5,"Five Stars","Excellent","https://www.amazon.com/gp/customer-reviews/R2G6XD9G6Y37R/ref=cm_cr_arp_d_rvw_ttl?ie=UTF8&ASIN=B00XEW3YD6","https://www.amazon.com/gp/pdp/profile/A2RO4W03TGQ5VV/ref=cm_cr_arp_d_pdp?ie=UTF8"
"Steve Thomas",26-Jan-2017,5,"Fantastic!","Easy setup out of the box. Works like a charm. Loving my eero.","https://www.amazon.com/gp/customer-reviews/RDJWICZV7CJ68/ref=cm_cr_arp_d_rvw_ttl?ie=UTF8&ASIN=B00XEW3YD6","https://www.amazon.com/gp/pdp/profile/A28NEK3BVB8JDQ/ref=cm_cr_arp_d_pdp?ie=UTF8"
"Matt",26-Jan-2017,5,"As good as advertised!","I live in a condo complex where my unit has 3 levels, lots of walls and stairs, and about 25 other wireless signals from neighbors. Traditional wifi setup (of a modem/router combo unit on the first floor and a range extender on the second level) just wasn't working. And believe me, I have tried and tried. After years of frustration and spotty signal strength from other products, I decided to go top of the line and order eero (3 pack). Finally, my problems are solved.About 15 minutes after opening the box, eero was updated and broadcasting. I've never had a problem since. My ISP (Comcast unfortunately) provides 75Mbps; every speed test I've run with eero indicates 80+. The handoff of devices from one router to the next is equally impressive. The real kicker is the wall to wall coverage though; signal strength is routinely double that (160+), when before that I felt lucky to get 10.I've used many devices at once; a wired computer, wired DVR, wireless DVR, wireless laptop, two iPads, three smart phones. None of them have ever lost a signal.Expensive yes, but so worth it.","https://www.amazon.com/gp/customer-reviews/R2V7JZAMLXEDCU/ref=cm_cr_arp_d_rvw_ttl?ie=UTF8&ASIN=B00XEW3YD6","https://www.amazon.com/gp/pdp/profile/A1DZE4Y3Q0YMK7/ref=cm_cr_arp_d_pdp?ie=UTF8"
"Dee Sooner",26-Jan-2017,3,"Only modest improvement with one Eero","I have a 932 sq foot home with only one person using, so I purchased a single Eero, per the recommendation on Eero's website and reviews on Amazon.  My internet speed increase and reliability has been, in a word, &#34;meh.&#34;  My Eero speed tests consistently report at least 5-8Mbps faster than my three other third-party tests report (Simple Speed, SpeedSpot, AT&T speed test), so I'm not sure what is true.  I have the following devices connected: Macbook, iPhone, Ring doorbell, Sonos, HP printer, Roku.  I have CenturyLink 20Mbps download internet access, which is probably average for people in my income range, neighborhood and usage.  I'm not sure a modest performance improvement was worth $200; while I haven't tested it, I may achieve just as much or more improvement upgrading to CenturyLink 40Mbps download.  I'm sure it is a fantastic device if one has a 2,000+ sq ft home with 2 stories and uses 2-3 Eeros; I have friends who love it.  But I have not experienced a material improvement for a smallish one-story home.In researching the Eero website, blog and support board, even a single Eero is claimed to outperform a home router, though Eero is certainly designed to work best as a system. Performance includes more than just speed - also includes buffering, reliability and reach. Overall, I saw only a small increase in overall performance of my home network with one Eero. Bottom line: if you have a home &#60;1,000 sq feet, a cord-cutter who streams everything, and have only modest disposable income, you are not Eero's target market. Frankly, I'm not sure why Eero even encourages anyone to purchase just one Eero, as clearly it works best as a system of at least 2-3 Eeros to reach all areas of a bigger home. It is disappointing that Eero's customer support is blaming the customer - me - for my simply not understanding.  I will be returning.","https://www.amazon.com/gp/customer-reviews/R3SYN3YGFPK4PG/ref=cm_cr_arp_d_rvw_ttl?ie=UTF8&ASIN=B00XEW3YD6","https://www.amazon.com/gp/pdp/profile/A2HMG7E6K6KPYG/ref=cm_cr_arp_d_pdp?ie=UTF8"
"Curt Johnson",26-Jan-2017,5,"Delivered beyond my expectations","I read many reviews about the system and decided to make the investment for family Christmas present.  WOW!! We had been using a router and extender combo.  It was unreliable and had entire family frustrated about functionality.  It took me 20 minutes to set up all 3 units, sign in all devices to the new system and download the app.  It has delivered a consistent and superior experience to previous setup.  My advice to anyone looking at this solution is to buy it.  You will not be disappointed.","https://www.amazon.com/gp/customer-reviews/R3K8B07JSLB9NV/ref=cm_cr_arp_d_rvw_ttl?ie=UTF8&ASIN=B00XEW3YD6","https://www.amazon.com/gp/pdp/profile/AY6RYMYC0YSS8/ref=cm_cr_arp_d_pdp?ie=UTF8"
"suellen adams",26-Jan-2017,5,"Don't wait, just buy it!","I don't know why I waited so long to take the plunge.  Replaced my old wifi+wifi extender setup with 3 eero's and the difference is night and day.  Fast throughput everywhere in the house, and it doesn't just randomly stop working every day or two like the old setup.  Installation was simple and it just worked.  Highly recommended","https://www.amazon.com/gp/customer-reviews/R3I477FDQCZG8P/ref=cm_cr_arp_d_rvw_ttl?ie=UTF8&ASIN=B00XEW3YD6","https://www.amazon.com/gp/pdp/profile/AE1XKPGGERQ5G/ref=cm_cr_arp_d_pdp?ie=UTF8"
